"paragraph_i";"sentence_j";"label_binary_test_set_mistral_annotated";"headline";"paragraph_text";"year";"sentence_text";"date";"newspaper";"content";"article_id";"label_component_test_set_mistral_annotated";"label_binary_test_set_llama_annotated";"label_component_test_set_llama_annotated";"label_binary_test_set_deepseek_annotated";"label_component_test_set_deepseek_annotated";"label_binary_test_set_magistral_annotated";"label_component_test_set_magistral_annotated";"label_binary_final";"label_component_final";"label_source"
"1";"2";"argumentative";"Juego de culpas en Larcomar";"En los últimos días, cuatro instituciones involucradas en el incendio en los cines UVK del centro comercial Larcomar han deslindado responsabilidades sobre el incendio y la falta de seguridad en estas instalaciones. UVK Multicines declara que en marzo hubo una inspección de la Municipalidad de Miraflores, tras la cual no se hizo ninguna observación al cine. Dijeron que todo estaba bajo las normas, afirmó la gerenta general de la cadena de cines, Mónica Ubillús. El alcalde de Miraflores criticó que los planos de UVK no consideraban las modificaciones descritas anteriormente. Quisieron dar gato por liebre, dijo. También responsabilizó a la Municipalidad de Lima de haber emitido certificados de Defensa Civil pese a la modificación de infraestructura. A su vez, el subgerente de Defensa Civil de la Municipalidad de Lima, Mario Casaretto, responsabilizó al municipio de Miraflores por el incendio en Larcomar, por no realizar la inspección que le había solicitado el centro comercial a inicios de agosto. En tanto, se hizo público el pedido que realizó UVK Larcomar a la Municipalidad de Miraflores, en agosto de este año. La institución, liderada por el alcalde Jorge Muoz, reconoció que no había verificado el establecimiento pese a la solicitud. El alcalde calificó esta omisión de error imperdonable y dijo que funcionarios de la Subgerencia de Defensa Civil serán removidos del cargo, aunque no precisó quiénes. Además, se accedió al certificado de inspección técnica de seguridad de Defensa Civil emitido a Larcomar en julio del 2014 por la Municipalidad Metropolitana de Lima. Este fue el último informe que emiti el municipio metropolitano, ya que posteriormente el Gobierno decretó que la seguridad de los establecimientos comerciales es responsabilidad de las comunas distritales. Este informe fue entregado antes de que se declarara que los certificados de Defensa Civil son de vigencia indefinida, por ello Miraflores sí tenía la obligación de inspeccionar los cines UVK. Al cierre de esta edición, pese a las insistencias, UVK Multicines no ha declarado acerca del cambio de infraestructura.";"2016";"Dijeron que todo estaba bajo las normas, afirmó la gerenta general de la cadena de cines, Mónica Ubillús.";"2016-11-22";"elcomercio";"Casi una semana después del incendio en Larcomar, que dej cuatro personas muertas, la responsabilidad de las instituciones involucradas comienza a revelarse. Una reciente denuncia difundida por la Municipalidad de Miraflores compromete a UVK Multicines en los hechos ocurridos el último miércoles 16. Según el alcalde Jorge Muoz Wells, en su visita a Larcomar tras el incendio se constató que un área destinada a camerinos de hombres y mujeres, para uso del personal de UVK, había sido transformada en oficinas administrativas, las cuales tugurizaron la zona interrumpiendo las rutas de escape. Esta modificación difiere de los planos que había aprobado la Municipalidad Metropolitana de Lima. La construcción y planos alterados se enfrentaban a una construcción diferente, señaló Muoz. Larcomar, a través de sus voceros, dijo que conocía ese cambio de infraestructura, pero que la autoridad para fiscalizar estas modificaciones era la Municipalidad de Miraflores y que ni UVK ni cualquier otra empresa que opere en Larcomar están obligadas a informar sobre estos cambios. Según Muoz, los planos de UVK no señalan la transformación que hicieron en el espacio para los vestidores, lo cual pudo haber influido en la dificultad para salir del lugar. Tres de las cuatro víctimas perdieron la vida en estas instalaciones. En los últimos días, cuatro instituciones involucradas en el incendio en los cines UVK del centro comercial Larcomar han deslindado responsabilidades sobre el incendio y la falta de seguridad en estas instalaciones. UVK Multicines declara que en marzo hubo una inspección de la Municipalidad de Miraflores, tras la cual no se hizo ninguna observación al cine. Dijeron que todo estaba bajo las normas, afirmó la gerenta general de la cadena de cines, Mónica Ubillús. El alcalde de Miraflores criticó que los planos de UVK no consideraban las modificaciones descritas anteriormente. Quisieron dar gato por liebre, dijo. También responsabilizó a la Municipalidad de Lima de haber emitido certificados de Defensa Civil pese a la modificación de infraestructura. A su vez, el subgerente de Defensa Civil de la Municipalidad de Lima, Mario Casaretto, responsabilizó al municipio de Miraflores por el incendio en Larcomar, por no realizar la inspección que le había solicitado el centro comercial a inicios de agosto. En tanto, se hizo público el pedido que realizó UVK Larcomar a la Municipalidad de Miraflores, en agosto de este año. La institución, liderada por el alcalde Jorge Muoz, reconoció que no había verificado el establecimiento pese a la solicitud. El alcalde calificó esta omisión de error imperdonable y dijo que funcionarios de la Subgerencia de Defensa Civil serán removidos del cargo, aunque no precisó quiénes. Además, se accedió al certificado de inspección técnica de seguridad de Defensa Civil emitido a Larcomar en julio del 2014 por la Municipalidad Metropolitana de Lima. Este fue el último informe que emiti el municipio metropolitano, ya que posteriormente el Gobierno decretó que la seguridad de los establecimientos comerciales es responsabilidad de las comunas distritales. Este informe fue entregado antes de que se declarara que los certificados de Defensa Civil son de vigencia indefinida, por ello Miraflores sí tenía la obligación de inspeccionar los cines UVK. Al cierre de esta edición, pese a las insistencias, UVK Multicines no ha declarado acerca del cambio de infraestructura.";"ART_002782";"premise";"argumentative";"premise";"argumentative";"premise";"nc";"nc";"PENDING";"PENDING";"manual"
"3";"2";"argumentative";"Necesidad de Actualización de las Políticas Migratorias";"Por ello, la disyuntiva no radica en las capacidades del mercado doméstico sino en cómo otorgarles mayor conocimiento. Adicionalmente, aprovechando que el Estado realiza reformas para reducir procesos burocráticos, cabría considerar que la lógica de atraer inversión extranjera debe ligarse a la realidad empresarial. No es consecuente, por ejemplo, invitar a invertir en el país con capital económico extranjero pero sin capital humano; es decir, sin las personas en las que inicialmente cualquier empresario confiaría para desarrollar e iniciar los proyectos, pudiendo a futuro confiar en el personal local que haya obtenido conocimiento necesario in situ.";"2014";"No es consecuente, por ejemplo, invitar a invertir en el país con capital económico extranjero pero sin capital humano; es decir, sin las personas en las que inicialmente cualquier empresario confiaría para desarrollar e iniciar los proyectos, pudiendo a futuro confiar en el personal local que haya obtenido conocimiento necesario in situ.";"2014-08-28";"elcomercio";"Al revisar la forma en que se encuentra regulada la obtención de visas de trabajo para personal extranjero en el país, así como las normas que regulan actualmente sus permisos de trabajo, notamos que muchas de las trabas y limitaciones actuales no se encuentran alineadas con el interés nacional de atraer inversión extranjera. Por ejemplo, existe una limitación de contratación a base del número (20%) y remuneración (30%) del personal expatriado en relación con el personal local que no se ajusta a una necesidad de mercado sino a un límite arbitrario impuesto por el Legislativo hace más de veinte años, cuando la situación económica del Perú era distinta. Si quisieramos mantener los límites como una herramienta de control para el ingreso de extranjeros, podríamos crear a la par mecanismos de incentivos a su llegada, evaluando a base de la demanda de trabajo, qué oficios requieren ser fomentados y qué otros limitados, en caso hubiera profesionales suficientes en aquellos campos de estudio en el país. Esta opción no solo permitiría abastecer de conocimiento sectores que lo requieren, facilitando el ingreso de personal especializado en estas áreas, sino que a la vez podría traer a discusión la necesidad que tienen las entidades educativas, incluidas las universidades, de enfocar las carreras ofrecidas en la demanda real que exista en el mercado local a efectos de no sobrepoblar de profesionales al mercado en materias que no requiere. Precisamente, a fin de lograr que el personal local se capacite, se requiere captar conocimiento y experiencia de industrias aún no desarrolladas en el país, para así ayudar a que estos adquieran ese conocimiento y eventualmente lo mejoren, incrementando así nuestra competitividad. No todo trabajador nacional puede estudiar en el extranjero, por lo que conseguir personal especializado foráneo es un mecanismo que nos puede ayudar a adquirir conocimiento para industrias peruanas enriqueciendo y diversificando nuestro mercado. Por ello, la disyuntiva no radica en las capacidades del mercado doméstico sino en cómo otorgarles mayor conocimiento. Adicionalmente, aprovechando que el Estado realiza reformas para reducir procesos burocráticos, cabría considerar que la lógica de atraer inversión extranjera debe ligarse a la realidad empresarial. No es consecuente, por ejemplo, invitar a invertir en el país con capital económico extranjero pero sin capital humano; es decir, sin las personas en las que inicialmente cualquier empresario confiaría para desarrollar e iniciar los proyectos, pudiendo a futuro confiar en el personal local que haya obtenido conocimiento necesario in situ. Por otro lado, a la fecha existe un error de interpretación de la autoridad migratoria cuya revisión es urgente. Para fines tributarios se considera renta de fuente peruana la originada en actividades civiles o empresariales que se realicen en el territorio nacional, siendo irrelevante la nacionalidad de la persona, e importando solamente que el trabajo personal sea desarrollado en el Perú, salvo excepciones expresas. No obstante, la Ley de Extranjería establece...";"ART_002870";"claim";"argumentative";"claim";"nc";"nc";"argumentative";"claim";"PENDING";"PENDING";"manual"
"0";"4";"argumentative";"Informalidad laboral en el Perú";"Subgrupos de la PEA según dependencia laboral y contribuciones fiscales. Solo el 11% de trabajadores paga Impuesto a la Renta. Cambio de enfoque ● Una nueva aproximación al mercado laboral advierte sobre el alto nivel de informalidad que existe entre los trabajadores del país y llama la atención sobre sus principales razones. El mercado laboral del Perú está compuesto por alrededor de 16 millones de personas. Sin embargo, de estos solo 1,3 millones pagan impuestos por sus ingresos. Es decir, solo el 11% de los trabajadores que componen la población económicamente activa (PEA) ocupada cumple su obligación tributaria. Además, solo el 17% de la PEA ocupada tiene un contrato laboral. As lo reveló el reciente estudio Una radiografía del contribuyente peruano, elaborado por la asociación Contribuyentes por Respeto (CpR) y que fue compartido en exclusiva con El Comercio. En este, se analiza el mercado laboral desde la perspectiva tributaria –trabajadores que pagan impuestos (contribuyentes) y los que no (no contribuyentes)– y se distinguen cuatro grupos: los trabajadores dependientes contribuyentes, los dependientes no contribuyentes, los trabajadores independientes contribuyentes y los independientes no contribuyentes. El objetivo es analizar la formalidad laboral, no solo desde el punto de recibir beneficios sociales, sino con el pago de impuestos.";"2016";"El mercado laboral del Perú está compuesto por alrededor de 16 millones de personas.";"2016-05-09";"elcomercio";"Subgrupos de la PEA según dependencia laboral y contribuciones fiscales. Solo el 11% de trabajadores paga Impuesto a la Renta. Cambio de enfoque ● Una nueva aproximación al mercado laboral advierte sobre el alto nivel de informalidad que existe entre los trabajadores del país y llama la atención sobre sus principales razones. El mercado laboral del Perú está compuesto por alrededor de 16 millones de personas. Sin embargo, de estos solo 1,3 millones pagan impuestos por sus ingresos. Es decir, solo el 11% de los trabajadores que componen la población económicamente activa (PEA) ocupada cumple su obligación tributaria. Además, solo el 17% de la PEA ocupada tiene un contrato laboral. As lo reveló el reciente estudio Una radiografía del contribuyente peruano, elaborado por la asociación Contribuyentes por Respeto (CpR) y que fue compartido en exclusiva con El Comercio. En este, se analiza el mercado laboral desde la perspectiva tributaria –trabajadores que pagan impuestos (contribuyentes) y los que no (no contribuyentes)– y se distinguen cuatro grupos: los trabajadores dependientes contribuyentes, los dependientes no contribuyentes, los trabajadores independientes contribuyentes y los independientes no contribuyentes. El objetivo es analizar la formalidad laboral, no solo desde el punto de recibir beneficios sociales, sino con el pago de impuestos. ‘Rigidez en contra’ – Una de las principales conclusiones a las que llega este estudio es que el nivel de educación no tiene relación directa con el nivel de ingresos que percibe el trabajador. Por ejemplo, los trabajadores independientes que pagan impuestos son los que cuentan con el menor nivel de instrucción, pero son los que perciben el ingreso más alto. Si bien CpR no ha analizado en profundidad este punto, sí puede dar luces de un problema significativo. ‘Como indicio, podría responder a lo caras que son la formalidad y la dependencia [laboral]. Tener a un trabajador en planilla requiere un 45% adicional de lo que se le paga. Si tu sueldo es S/5.000, a la empresa realmente le cuesta aproximadamente 45% más: por compensación de tiempo de servicios (CTS), liquidación, vacaciones truncas, gratificaciones, etc. Solo el hecho de que anualmente te cuesta 45% más por un trabajador te hace optar por locadores de servicios que ganan más pero son más baratos para la empresa’, indic José Ignacio Beteta, director gerente de CpR. Los altos costos laborales –por ejemplo, los derivados de la dificultad de desvincular a un trabajador– también hacen que las empresas opten por contratar a los trabajadores por un plazo fijo y les renueven el contrato periódicamente. ‘El que el Tribunal Constitucional haya interpretado que para ciertos tipos de despido la única compensación adecuada sea la reposición en el puesto de trabajo pone muy nerviosas a las empresas, porque eso significa que";"ART_002900";"premise";"argumentative";"premise";"non-argumentative";"none";"nc";"nc";"PENDING";"PENDING";"manual"
"0";"0";"non-argumentative";"EntrEvista James Valenzuela";"Vamos a expandir nuestra oferta de maquinaria Resemin es una compañía peruana especializada en fabricación de maquinaria para minas bajo tierra que ya ha llegado a África e India. James Valenzuela, su gerente general, contó a El Comercio los planes de expansión de la compañía. —Su padre trabajó en la mina Toquepala. ¿Cómo influyó esto en su elección de la ingeniería de minas? Haber crecido en una villa minera definitivamente marcó un impulso temprano, aunque yo estaba más interesado en ese entonces en historia, física y geografía. —¿Por qué y cuándo decidi convertirse en empresario? La escasez de bienes y productos industriales originada por las políticas económicas del primer gobierno de Alan García fue un escenario de oportunidades para hacer negocios. —Fundó Resemin en 1989. ¿Cuál ha sido el obstáculo más difícil que ha tenido que enfrentar? La escasez de productos industriales. Había un mercado deprimido. Encaré los mayores obstáculos a mediados de los años noventa, cuando la empresa tuvo que sobrevivir en un entorno económico limitado en términos de tamaño y tecnología. Toda esta combinación puso a prueba nuestra resistencia. —El nicho de su negocio es muy específico. Resemin es la tercera compañía en el mundo en la fabricación de máquinas para minas bajo tierra. ¿Qué se viene para la empresa en el corto, mediano y largo plazo? Fabricamos equipos de perforación de túneles para minería subterránea y construcción civil. Estas máquinas son llamadas también ‘jumbos’. Estamos en proceso de expandir nuestra oferta de maquinaria hacia los cargadores de bajo perfil, también denominados ‘scoops’ o ‘loaders’. —La compañía tiene presencia en África e India. ¿Cómo llegaron a estos mercados? Llegamos a Zambia en el 2002 como consecuencia de una venta de equipos a una mina del grupo Glencore, que posteriormente nos pidi operar los equipos que les suministramos. Así nos convertimos en contratistas de túneles. Esta incursión originó una nueva línea de negocios y el resultado actual es un grupo de siete empresas ubicadas en Zambia, República Democrática del Congo, India, Argentina, México y el Per. —¿Qué volumen de ventas alcanza la compañía? En el 2016, Resemin facturó US$42 millones. El grupo alcanzó los US$74 millones. —¿Cuánto esperan crecer este año en relación con el año previo y cuanto esperan invertir? El año pasado crecimos 38% y este año esperamos llegar a 20%. Estamos ampliando nuestra capacidad instalada, también contemplamos producir en otro país. —¿Qué se siente haber sido reconocido como un líder empresarial del cambio y por qué cree que ha sido elegido? Es un reconocimiento a todos los que trabajamos en el Grupo Resemin, dentro y fuera del Per, sin ellos no lo hubiéramos logrado y lo mejor está aún por venir.";"2017";"Vamos a expandir nuestra oferta de maquinaria Resemin es una compañía peruana especializada en fabricación de maquinaria para minas bajo tierra que ya ha llegado a África e India.";"2017-03-03";"elcomercio";"Vamos a expandir nuestra oferta de maquinaria Resemin es una compañía peruana especializada en fabricación de maquinaria para minas bajo tierra que ya ha llegado a África e India. James Valenzuela, su gerente general, contó a El Comercio los planes de expansión de la compañía. —Su padre trabajó en la mina Toquepala. ¿Cómo influyó esto en su elección de la ingeniería de minas? Haber crecido en una villa minera definitivamente marcó un impulso temprano, aunque yo estaba más interesado en ese entonces en historia, física y geografía. —¿Por qué y cuándo decidi convertirse en empresario? La escasez de bienes y productos industriales originada por las políticas económicas del primer gobierno de Alan García fue un escenario de oportunidades para hacer negocios. —Fundó Resemin en 1989. ¿Cuál ha sido el obstáculo más difícil que ha tenido que enfrentar? La escasez de productos industriales. Había un mercado deprimido. Encaré los mayores obstáculos a mediados de los años noventa, cuando la empresa tuvo que sobrevivir en un entorno económico limitado en términos de tamaño y tecnología. Toda esta combinación puso a prueba nuestra resistencia. —El nicho de su negocio es muy específico. Resemin es la tercera compañía en el mundo en la fabricación de máquinas para minas bajo tierra. ¿Qué se viene para la empresa en el corto, mediano y largo plazo? Fabricamos equipos de perforación de túneles para minería subterránea y construcción civil. Estas máquinas son llamadas también ‘jumbos’. Estamos en proceso de expandir nuestra oferta de maquinaria hacia los cargadores de bajo perfil, también denominados ‘scoops’ o ‘loaders’. —La compañía tiene presencia en África e India. ¿Cómo llegaron a estos mercados? Llegamos a Zambia en el 2002 como consecuencia de una venta de equipos a una mina del grupo Glencore, que posteriormente nos pidi operar los equipos que les suministramos. Así nos convertimos en contratistas de túneles. Esta incursión originó una nueva línea de negocios y el resultado actual es un grupo de siete empresas ubicadas en Zambia, República Democrática del Congo, India, Argentina, México y el Per. —¿Qué volumen de ventas alcanza la compañía? En el 2016, Resemin facturó US$42 millones. El grupo alcanzó los US$74 millones. —¿Cuánto esperan crecer este año en relación con el año previo y cuanto esperan invertir? El año pasado crecimos 38% y este año esperamos llegar a 20%. Estamos ampliando nuestra capacidad instalada, también contemplamos producir en otro país. —¿Qué se siente haber sido reconocido como un líder empresarial del cambio y por qué cree que ha sido elegido? Es un reconocimiento a todos los que trabajamos en el Grupo Resemin, dentro y fuera del Per, sin ellos no lo hubiéramos logrado y lo mejor está aún por venir.";"ART_003019";"none";"argumentative";"premise";"non-argumentative";"none";"nc";"nc";"PENDING";"PENDING";"manual"
