"paragraph_i";"sentence_j";"label_binary_test_set_mistral_annotated";"headline";"paragraph_text";"year";"sentence_text";"date";"newspaper";"content";"article_id";"label_component_test_set_mistral_annotated";"label_binary_test_set_llama_annotated";"label_component_test_set_llama_annotated";"label_binary_test_set_deepseek_annotated";"label_component_test_set_deepseek_annotated";"label_binary_test_set_magistral_annotated";"label_component_test_set_magistral_annotated";"label_binary_final";"label_component_final";"label_source"
"0";"1";"argumentative";"España fue el destino más visitado";"Más de 750 mil peruanos logran viajar a países del espacio Schengen de la Unión Europea después de que en marzo de 2016 se eximió el requisito de la visa para ingresar en esa región como turistas, informó Migraciones. La institución reveló que el país más visitado por nuestros compatriotas fue España, donde llegaron al menos 520 mil. No obstante, señalaron que muchos de estos llegaron al país ibérico solo para hacer una conexión hacia otras naciones europeas o incluso, a otros continentes. Según se informó, el segundo destino preferido por los peruanos, desde que se eliminó el requisito de la visa especial, ha sido los Países Bajos (Holanda), adonde acudieron más de 136 mil connacionales. En tanto, el tercer país con mayor número de visitantes peruanos es Francia, adonde arribaron, en vuelo directo, 88 mil compatriotas en los últimos tres años. Italia (7933), Alemania (2228), Suiza (935), Suecia (354), Bélgica (284), entre otras naciones, son los otros destinos que recibieron a un número considerable de visitantes peruanos.";"2019";"La institución reveló que el país más visitado por nuestros compatriotas fue España, donde llegaron al menos 520 mil.";"2019-05-05";"correo";"Más de 750 mil peruanos logran viajar a países del espacio Schengen de la Unión Europea después de que en marzo de 2016 se eximió el requisito de la visa para ingresar en esa región como turistas, informó Migraciones. La institución reveló que el país más visitado por nuestros compatriotas fue España, donde llegaron al menos 520 mil. No obstante, señalaron que muchos de estos llegaron al país ibérico solo para hacer una conexión hacia otras naciones europeas o incluso, a otros continentes. Según se informó, el segundo destino preferido por los peruanos, desde que se eliminó el requisito de la visa especial, ha sido los Países Bajos (Holanda), adonde acudieron más de 136 mil connacionales. En tanto, el tercer país con mayor número de visitantes peruanos es Francia, adonde arribaron, en vuelo directo, 88 mil compatriotas en los últimos tres años. Italia (7933), Alemania (2228), Suiza (935), Suecia (354), Bélgica (284), entre otras naciones, son los otros destinos que recibieron a un número considerable de visitantes peruanos.";"ART_000052";"premise";"argumentative";"premise";"nc";"nc";"argumentative";"claim";"PENDING";"PENDING";"manual"
"0";"1";"argumentative";"Préstamos online. Las escalas salariales transparentes";"La próxima semana se publicará el reglamento de préstamos por internet la Ley de Igualdad Salarial, que obligará hoy a todas las compañías a tener perfiles de trabajo definidos con sueldos claros por cargo. Germán Lora, del Estudio Payet, Rey, Cauvi, Pérez Abogados, advirtió que empresas tienen hasta junio para ajustarse a la medida.";"2018";"Germán Lora, del Estudio Payet, Rey, Cauvi, Pérez Abogados, advirtió que empresas tienen hasta junio para ajustarse a la medida.";"2018-02-21";"correo";"La próxima semana se publicará el reglamento de préstamos por internet la Ley de Igualdad Salarial, que obligará hoy a todas las compañías a tener perfiles de trabajo definidos con sueldos claros por cargo. Germán Lora, del Estudio Payet, Rey, Cauvi, Pérez Abogados, advirtió que empresas tienen hasta junio para ajustarse a la medida.";"ART_000053";"claim";"argumentative";"claim";"nc";"nc";"argumentative";"claim";"PENDING";"PENDING";"manual"
"0";"0";"argumentative";"Locales informales en la mira";"Defensa Civil alertó que el 60% de locales, entre bares y discotecas, de los distritos de Chiclayo y José Leonardo Ortiz, son informales. Además, no cumplen con las medidas sanitarias ni de seguridad para recibir a clientes.";"2020";"Defensa Civil alertó que el 60% de locales, entre bares y discotecas, de los distritos de Chiclayo y José Leonardo Ortiz, son informales.";"2020-08-25";"correo";"Defensa Civil alertó que el 60% de locales, entre bares y discotecas, de los distritos de Chiclayo y José Leonardo Ortiz, son informales. Además, no cumplen con las medidas sanitarias ni de seguridad para recibir a clientes.";"ART_000352";"premise";"argumentative";"premise";"nc";"nc";"argumentative";"claim";"PENDING";"PENDING";"manual"
"0";"8";"argumentative";"Brindar detalles de accidente";"Melcochita regresa mañana a Lima tras choque. Impacto de auto con motocicleta en línea el Paín provocó la muerte de un ciclista y dejó un hombre herido. Correo | Redacción. El cómico Pablo Villanueva, más conocido como Melcochita, garantizará mañana en Lima y ofrecerá una conferencia de prensa para dar detalles del accidente vehicular que tuvo y que ocasionó la muerte de un motociclista y dejó a un hombre herido en Paín (Ascope, La Libertad), informó Susan Villanueva, hija del humorista. Mi padre se encuentra muy apenado. Tiene 81 años de edad. El fatal choque ocurrió el pasado miércoles en Paín. / No se ha podido hablar con mi pap sobre lo que ha pasado exactamente. Él va a venir a Lima el lunes y va a aclarar todo, declaró Susan en RPP Noticias. Cumplir. La hija de Melcochita reafirmó que su padre cubrirá los gastos de la operación y tratamiento de Jorge Luis Saldaña Sánchez, el pasajero de la moto que resultó herido.";"2016";"Él va a venir a Lima el lunes y va a aclarar todo, declaró Susan en RPP Noticias.";"2016-12-25";"correo";"Melcochita regresa mañana a Lima tras choque Impacto de auto con motocicleta en línea el Paín provocó la muerte de un ciclista y dejó un hombre herido Correo | Redacción El cómico Pablo Villanueva, más conocido como Melcochita, garantiará mañana en Lima y ofrecerá una conferencia de prensa para dar detalles del accidente vehicular que tuvo y que ocasionó la muerte de un motociclista y dejó a un hombre herido en Paín (Ascope, La Libertad), informó Susan Villanueva, hija del humorista. Mi padre se encuentra muy apenado. Tiene 81 años de edad. El fatal choque ocurrió el pasado miércoles en Paín. / No se ha podido hablar con mi pap sobre lo que ha pasado exactamente. Él va a venir a Lima el lunes y va a aclarar todo, declaró Susan en RPP Noticias. Cumplir. La hija de Melcochita reafirmó que su padre cubrirá los gastos de la operación y tratamiento de Jorge Luis Saldaña Sánchez, el pasajero de la moto que resultó herido.";"ART_000456";"claim";"non-argumentative";"none";"nc";"nc";"argumentative";"claim";"PENDING";"PENDING";"manual"
"0";"1";"non-argumentative";"De chatarra";"Depósitos clandestinos de chatarra, ubicados entre las cuadras 11, 12 y 13 de la Av. Prolongación Huánuco, fueron erradicados por el municipio de La Victoria por ser un peligro para los vecinos.";"2015";"Prolongación Huánuco, fueron erradicados por el municipio de La Victoria por ser un peligro para los vecinos.";"2015-08-15";"correo";"Depósitos clandestinos de chatarra, ubicados entre las cuadras 11, 12 y 13 de la Av. Prolongación Huánuco, fueron erradicados por el municipio de La Victoria por ser un peligro para los vecinos.";"ART_000521";"none";"argumentative";"premise";"nc";"nc";"argumentative";"claim";"PENDING";"PENDING";"manual"
"1";"0";"non-argumentative";"Tema del da";"Costos del paro. El ministro del Interior dijo que el paro en Islay est costando ms de 10 millones de soles solo en viticos para los agentes. El jefe del Estado seal: Muchas voces reclaman la suspensin del proyecto por parte del Ejecutivo, aun sabiendo que no solo no se puede suspender lo que no se ha iniciado, sino, peor aun, sabiendo que el Estado no puede adoptar una decisin unilateral que no est regida por ley [...]. Fueron el primer ministro, Pedro Cateriano, en el Congreso, y el presidente ejecutivo de Southern, scar Gonzlez, a travs de un pronunciamiento de la empresa, quienes hicieron oficial la decisin minutos despus de que hablara el jefe del Estado. He sido informado de que la empresa [Southern] acepta una pausa para que este proyecto [Ta Mara] pueda ser discutido tcnicamente, deca Cateriano al inicio de su intervencin en el pleno. Por su lado el empresario peda tiempo y facilidades necesarias para poder socializar el proyecto y despejar todas las dudas existentes en los prximos 60 das. Y agregaba que ningn inters poltico ni empresarial puede estar por encima de la vida y la paz, adems de expresar su voluntad para un dilogo constructivo.";"2015";"Costos del paro.";"2015-05-16";"elcomercio";"Tras violentas protestas Ta Mara, una pausa incierta Presidente de Southern Per anuncia suspensin de 60 das para despejar dudas y dialogar. Humala invoca unidad en favor de inversiones. El parntesis en la ejecucin del proyecto minero habra sido el resultado de la bsqueda de una salida consensuada entre el Ejecutivo y la empresa minera. Es prematuro decir si las actividades podrarn reanudarse dentro de dos meses en Arequipa. Cuando el presidente Ollanta Humala invocaba ayer a la empresa Southern Per que ejecute acciones concretas para el entendimiento, en aras de la paz social para la ejecucin del proyecto Ta Mara, esperaba que horas despus de su mensaje a la nacin representantes de la firma anunciasen una pausa del mismo. Y as fue. Este Diario conoci que hace unos das el primer ministro Pedro Cateriano convers con representantes de esta compaa minera de capitales mexicanos, y all se habra planteado hacer un parntesis, previa invocacin del presidente Humala en ese sentido. No de una suspensin porque el Gobierno est a favor del proyecto, dijeron fuentes confiables. Estas sealaron que si bien el proyecto naci mal en el 2010 con el gobierno aprista, se ha corregido en estos aos y algunos aspectos se pueden mejorar en una mesa de dilogo con la poblacin. Tambin indicaron que el presidente no anunci la pausa en su mensaje a la nacin porque no se tena la certeza de los trminos en que la empresa se pronunciara. Eso explicara por qu Humala solo hizo nfasis en que el Estado no poda tomar la decisin de suspender Ta Mara de manera unilateral. Costos del paro El ministro del Interior dijo que el paro en Islay est costando ms de 10 millones de soles solo en viticos para los agentes. El jefe del Estado seal: Muchas voces reclaman la suspensin del proyecto por parte del Ejecutivo, aun sabiendo que no solo no se puede suspender lo que no se ha iniciado, sino, peor aun, sabiendo que el Estado no puede adoptar una decisin unilateral que no est regida por ley [...]. Fueron el primer ministro, Pedro Cateriano, en el Congreso, y el presidente ejecutivo de Southern, scar Gonzlez, a travs de un pronunciamiento de la empresa, quienes hicieron oficial la decisin minutos despus de que hablara el jefe del Estado. He sido informado de que la empresa [Southern] acepta una pausa para que este proyecto [Ta Mara] pueda ser discutido tcnicamente, deca Cateriano al inicio de su intervencin en el pleno. Por su lado el empresario peda tiempo y facilidades necesarias para poder socializar el proyecto y despejar todas las dudas existentes en los prximos 60 das. Y agregaba que ningn inters poltico ni empresarial puede estar por encima de la vida y la paz, adems de expresar su voluntad para un dilogo constructivo. Invocacin a clase poltica Humala tambin exhort a la clase poltica a unirse en favor de las inversiones y solicit a las autoridades judiciales sancionar ejemplarmente a los delincuentes, asesinos y extorsionadores implicados en los hechos violentos del paro en Arequipa. Adems reconoci la labor de la polica por enfrentar estoicamente tal situacin. El analista poltico, Fernando Rospigliosi, critic al mandatario por no admitir responsabilidades luego de haber incentivado el discurso antiminerode cuando fue candidato. Y ahora por este psimo manejo de los reclamos, puntualiz. Record que en este gobierno se han suspendido otros proyectos mineros como Conga, en Cajamarca. En ese caso, la decisin de minera Yanacocha se dio luego de que el Ejecutivo planteara una nueva relacin entre la empresa minera y la comunidad. HuGo Prez Debilitado? La suspensin de Ta Mara se da en das previos a la presentacin de Cateriano en el pleno para pedir facultades legislativas. Reacciones Queremos invocar al cese de la violencia. Debemos apostar por el desarrollo de la regin, pero debemos pensar tambin en los agricultores. Ellos son parte de la economa. Desde Arequipa en declaraciones para El Comercio. Lo que Southern no ha logrado en cinco aos de conflicto, lo va a lograr en meses de suspensin? Por lgica, no. Menos con este gobierno, que prometi que lo que la poblacin decida, se har. En entrevista con Canal N. La minera Southern ha mandado el salvavidas, y eso seguro le va a afectar a la poblacin de Arequipa. El gobierno debi haber hecho algo en estos cuatro aos para informar a la poblacin. En declaraciones para El Comercio. El mensaje [de Humala] ha sido mesurado, comprometiendo a la empresa a asumir su responsabilidad. Apoyamos firmemente. El Estado no puede desconocer contratos. En entrevista con RPP Noticias. GuStAvO RoNdn Congresista de Solidaridad Nacional fReddY OtRoLA Congresista de Gana Per YamilA Osorio Gobernadora de Arequipa Marco ArAna Lder de Tierra y Libertad Gremio minero opina que esta decisin es positiva para el pas La pausa de sesenta das propuesta por Southern Per para socializar su proyecto cuprfero Ta Mara ha suscitado opiniones dispares en el empresariado nacional. Contrariamente a lo que se podra suponer, la Sociedad Nacional de Minera, Petrleo y Energia (SNMPE) salud la decisin de su asociada y destac su efecto positivo para Arequipa y el pas. Esta pausa o intervalo permitir generar un espacio para enfriar la tensin generada en Arequipa a raz del proyecto. En ese lapso habr tiempo para comunicar, levantar dudas y socializar mensajes [como el EIA] que no son fciles de transmitir por los mineros y, menos aun, de entender por la poblacin, indic Carlos Glvez, presidente del referido gremio minero-energtico. El funcionario plante a inicios de semana suspender el proyecto por 120 das, opinin que –segn supo este Diario– fue apoyada por un sector importante de la gran minera nacional y extranjera, temerosa de una escalada irreversible en el conflicto. En tanto, Martin Prez, presidente de la Confederacin Nacional de Instituciones Empresariales Peruanas (Confiep), manifest que la propuesta de Southern abre una opcin de dilogo que los peruanos estamos obligados a tomar para acabar con la violencia desatada en Arequipa. El canon de TA MARA 270 millones de soles anuales de canon generara el proyecto Ta Mara para el departamento de Arequipa. 64 millones de soles por concepto de canon recibira la provincia de Islay. El distrito de Cocachacra, donde se localiza la mina, obtendra 34 millones de soles por ao. Carlos Glvez, presidente de la SNMPE. Martin Prez, presidente de Confiep. En cambio, para el economista Pablo Bustamante, director del portal de anlisis Lampadia, la decisin adoptada por el productor cuprfero constituye una mala noticia, pues pone en riesgo la gran inversin que el pas necesita para seguir reduciendo sus niveles de pobreza. Si Ta Mara se convierte en un Conga, pasar lo mismo con el prximo proyecto minero, y con el siguiente, y all se acab toda la inversin. No solo hablamos de que Arequipa retrocedera a la poca del conflicto en torno a Egasa [2002], en que se paralizaron todas sus inversiones. Podra suceder lo mismo en el pas, exclam. Para garantizar la socializacin del proyecto durante los sesenta das de pausa (y evitar que esta transcurra en vano), Glvez propuso que el ministro del Ambiente, Manuel Pulgar-Vidal, participe y se convierta en actor principal del proceso, con la autoridad que le da su cargo. Guillermo Ferreyros, presidente de Cmex Per, agrego que el gobierno debe dar un mensaje ms fuerte para frenar la violencia y detener a los delincuentes que engaan a la poblacin o, de lo contrario, no fructificar el dilogo. Inversin en vilo El PBI de Arequipa aumentara 7,7% con Ta Mara Ta Mara (US$1.400 mlls.) debera contribuir a aliviar la carencia de grandes inversiones mineras posteriores al 2016, cuando acabe la construccin de Las Bambas, la ltima gran mina en el horizonte cercano. La suspensin del proyecto impedir que inicie su produccin en el 2017, como estimaba Southern. Se prev que Ta Mara produciria 120 mil toneladas de cobre anuales, volumen equivalente al 9% de la produccin local de este metal. Segn Rmulo Mucho, ex presidente del Instituto de Ingenieros de Minas del Per, Ta Mara representara el 7,7% del PBI de Arequipa y aadira al Per el 0,35% de su PBI. El proyecto generar 3.000 puestos de trabajo en su etapa de construccin y 650 (directos) en la de operacin.";"ART_000654";"none";"argumentative";"premise";"nc";"nc";"argumentative";"claim";"PENDING";"PENDING";"manual"
