"paragraph_i";"sentence_j";"label_binary_test_set_mistral_annotated";"headline";"paragraph_text";"year";"sentence_text";"date";"newspaper";"content";"article_id";"label_component_test_set_mistral_annotated";"label_binary_test_set_llama_annotated";"label_component_test_set_llama_annotated";"label_binary_test_set_deepseek_annotated";"label_component_test_set_deepseek_annotated";"label_binary_test_set_magistral_annotated";"label_component_test_set_magistral_annotated";"label_binary_final";"label_component_final";"label_source"
"1";"1";"argumentative";"Protesta contra Ta Mara en su hora más crítica";"El gobierno de Ollanta Humala decidi recurrir a las Fuerzas Armadas para recuperar el control de los distritos de Deán Valdivia y Cocachacra, luego de casi 50 días de haberse iniciado el paro indefinido en contra del proyecto de extracción de cobre Ta Mara. Una resolución suprema publicada ayer en El Peruano autoriza a las Fuerzas Armadas a intervenir y apoyar a la policía para liberar las vías y puentes que conducen a Cocachacra. El constitucionalista Enrique Bernales señala que es una medida de precaución necesaria que no contraviene la Carta Magna, siempre y cuando los militares no suplan las funciones de la policía.";"2015";"Una resolución suprema publicada ayer en El Peruano autoriza a las Fuerzas Armadas a intervenir y apoyar a la policía para liberar las vías y puentes que conducen a Cocachacra.";"2015-05-10";"elcomercio";"Se agrupan. En la plaza San Francisco del distrito de Cocachacra, un grupo de dirigentes arengó a la población para que mantenga el paro contra el proyecto minero Ta Mara, que empezó el pasado 23 de marzo. La agudización del conflicto Tres ministros llegaron ayer a Arequipa para establecer las acciones con las que policías y militares recuperarán el control de dos distritos de Islay. Mientras, los manifestantes también planifican cómo mantener sus acciones. carlos zanabria angulo Texto lino chipana Fotos Mollendo. El gobierno de Ollanta Humala decidi recurrir a las Fuerzas Armadas para recuperar el control de los distritos de Deán Valdivia y Cocachacra, luego de casi 50 días de haberse iniciado el paro indefinido en contra del proyecto de extracción de cobre Ta Mara . Una resolución suprema publicada ayer en El Peruano autoriza a las Fuerzas Armadas a intervenir y apoyar a la policía para liberar las vías y puentes que conducen a Cocachacra. El constitucionalista Enrique Bernales señala que es una medida de precaución necesaria que no contraviene la Carta Magna, siempre y cuando los militares no suplan las funciones de la policía. Primeros movimientos Desde ayer, a las 6 de la tarde, el personal de las Fuerzas Armadas empezó a llegar a la provincia de Islay. Miembros de la Marina se encargan de custodiar el puerto de Matarani, la Fuerza Aérea resguarda la planta de combustibles de Petro-Perú en Mollendo y el Ejército, el puente Pampa Blanca en Cocachacra. El ministro de Defensa, Jakke Valakivi, informó que el primer contingente de 500 hombres custodiar, además, los túneles de la carretera Panamericana que dan acceso a El Fiscal; un segundo contingente de 500 hombres llegar en las próximas horas. Los 4.000 policías desplegados a la provincia de Islay tienen el encargo de restablecer el tránsito entre Mejía y Cocachacra, para permitir que se retomen las actividades económicas y que los escolares puedan volver al colegio. El ministro del Interior, José Luis Pérez Guadalupe, explicó que una vez restablecido el orden esperan retomar las conversaciones, pero ahora con los verdaderos líderes agrarios del valle y sus autoridades, y no con los delincuentes que intentaron lucrar con la protesta. Se espera que de manera progresiva los contingentes policiales ingresen desde Chucarpay hacia Cocachacra y desde El Boquerón hacia Deán Valdivia. Los policías deben retirar los troncos, montículos de arena, llantas y otros obstáculos que los manifestantes fueron acumulando durante la protesta en medio de la carretera. Ayer los ministros Pérez Guadalupe, Valakivi y Gustavo Adrianzén de Justicia coordinaron en Mollendo el plan de operaciones para el restablecimiento del orden público. Dirigentes investigados El presidente de la Junta de Fiscales Superiores de Arequipa, Hugo Ramos, informó que el viernes recibieron los audios grabados por el abogado Jesús Gómez Urquizo y se dispuso que la Fiscalía Especializada en Crimen Organizado se encargue de la investigación. ‘Lo que está claro es que los dirigentes mencionados en el audio formaron una organización criminal que utilizaba las protestas para su beneficio personal’, dijo el magistrado. Pepé Julio Gutiérrez, presidente del Frente de Defensa del Valle de Tambo; Jaime de la Cruz Gallegos, alcalde de Deán Valdivia; y Jesús Cornejo Reynoso, presidente de la Junta de Usuarios del Valle de Tambo, serán investigados inicialmente por el delito de asociación ilícita para delinquir. El caso estaría a cargo de la fiscal Mariana Alexandra Cárdenas Ávila, que tendrá un plazo de 30 a 60 días para realizar las investigaciones. Los puntos bloqueados en el camino a Cocachacra Bloqueo Matarani Mollendo Proyecto minero Ta Mara CO STA NERA NORTE OCÉANO PACÍFICO La Curva Santuario Nacional Lagunas de Mejía Mina Ta Mara Mina La Tapada Río Tambobamba PANAMERICANA SUR El Fiscal Chucarpay Valle de Tambo HACIA MOQUEGUA Deán Valdivia Cocachacra Río Tambobamba AAAAAAAARRRRRRRRREEEEEEEEEEEEQQQQQQQQQQQQQQUUUUUUUUUUUUUIIIIIIIIIIIIPPPPPPPPPPPPPPPPPPPPPPPPPPPPPPPPPPPPAAAAAAAAAAAAAAAAAAAAAAAAAAAAAAAAAAAPunta de Bombón Algarrobo: Yamila Osorio, gobernadora regional de Arequipa ‘Ofrecer financiar la revisión del estudio de impacto ambiental del proyecto Ta Mara’ El abogado Jesús Gómez Urquizo –quién grabó el audio que incrimina al dirigente del Valle de Tambo Pepé Julio Gutiérrez en un negociado para levantar la protesta– aseguró que tiene elementos para pensar que la gobernadora de Arequipa, Yamila Osorio Delgado, también habría negociado con Gutiérrez Zevallos durante las largas reuniones que sostuvo durante el conflicto. La autoridad arequipeña rechazó la insinuación y le demandó mayor responsabilidad en sus declaraciones. Usted negoció con el dirigente Pepé Julio Gutiérrez? Claro, propusimos entregar los recursos para financiar la revisión del estudio de impacto ambiental por un organismo internacional independiente. Lo que dice el abogado Gómez es que usted también le habría ofrecido ‘lentejas’ al dirigente. Lo niego tajantemente, yo no me involucraría en un tema que raya con lo delincuencial. No tengo un nivel de confianza con los dirigentes para que puedan ofrecerme ‘negociados’ bajo la mesa. Pero a través de terceros? Si buscaron a terceros para que yo me involucre en un tema como este, no lo sé, pero le puedo asegurar que yo no me involucro en este tipo de asuntos de ninguna manera. Viuda de policía pide que se identifique a sus atacantes Jorge Malpartida Desde que su esposo, el brigadier PNP Alberto Henry Vásquez Durand, había sido asignado a controlar las protestas en la provincia de Islay, María Isabel Ibarra estaba acostumbrada a recibir una llamada en su celular muy temprano, en su domicilio de Cuzco. Alberto la despertaba desde hacía 20 días a las 6 a.m. para que su hijo se alistara para ir al colegio. La mañana del miércoles 6 de mayo, María Isabel no recibió ninguna llamada de su esposo. Tuvo un mal presentimiento: durante la madrugada había tenido una pesadilla. A las 10 a.m. intent comunicarse con el policía pero no contestaba. Ayer, tres días después de ser atacado a pedradas por una turba, Vásquez Durand falleció producto de un paro cardíaco a las 4 a.m., el brigadier tenía una grave fractura en el cráneo y se encontraba sedado y con respirador artificial. A las pocas horas de conocer la noticia, María Isabel habl brevemente con los medios locales y pidió que se encuentre a los asesinos de su esposo. ‘Pido que el presidente Ollanta Humala venga aquí y me explique por qué enviaron a un hombre de 50 años sin más defensa que un escudo. Pido que se identifiquen a sus asesinos’, reclam sollozando la viuda. Despedida El brigadier Alberto Henry Vásquez Durand será enterrado hoy, a las 11 a.m., en el cementerio Parque de la Esperanza de la ciudad de Arequipa. La Defensora del Pueblo exigi una exhaustiva investigación y sanción ejemplar a responsables del fallecimiento del policía. Traumatismo encefalocraneano Desde el 23 de marzo, en que comenzaron los disturbios contra Ta Mara, a la fecha 166 efectivos policiales han resultado heridos con pronósticos distintos. Muchos de ellos sufrieron traumatismo encefalocraneano (TEC) debido al impacto de piedras, las cuales fueron disparadas por honda de lana o huaraca. El TEC supone una lesión directa de las estructuras craneales, encefálicas o meningea. Puede originar un deterioro funcional del contenido craneal, así como la muerte. Masa encefálica expuesta El suboficial brigadier Alberto Henry Vásquez Durand, de 50 años, falleció ayer víctima de este tipo de lesión. El proyectil El tipo de lesión está determinado por la forma de la piedra que hace el impacto. Una piedra puntiaguda genera heridas con laceración de la piel. Fractura de cráneo A pesar de ser uno de los huesos más duros de romper, la fuerza y violencia con la que son disparadas las piedras pueden vencer la resistencia natural del cráneo. Ataque mortal Cuando una pedrada puede matar Huaraqueros de Puno y Cuzco han sido contratados como parte de una estrategia antiminera, según denuncia del ministro del Interior. Un policía herido por el impacto de piedras muri ayer. Usi Traumatismo encefalocraneano Desde el 23 de marzo, en que comenzaron los disturbios contra Ta Mara, a la fecha 166 efectivos policiales han resultado heridos con pronósticos distintos. Muchos de ellos sufrieron traumatismo encefalocraneano (TEC) debido al impacto de piedras, las cuales fueron disparadas por honda de lana o huaraca. El TEC supone una lesión directa de las estructuras craneales, encefálicas o meningea. Puede originar un deterioro funcional del contenido craneal, así como la muerte. Masa encefálica expuesta El suboficial brigadier Alberto Henry Vásquez Durand, de 50 años, falleció ayer víctima de este tipo de lesión. El proyectil El tipo de lesión está determinado por la forma de la piedra que hace el impacto. Una piedra puntiaguda genera heridas con laceración de la piel. Fractura de cráneo A pesar de ser uno de los huesos más duros de romper, la fuerza y violencia con la que son disparadas las piedras pueden vencer la resistencia natural del cráneo. Atacantes. Los huaraqueros han sido la punta de lanza de los manifestantes en los enfrentamientos. liliana michelena Los opositores al proyecto Ta Mara recurrieron esta semana a armas de guerra del antiguo Perú e hirieron a cuatro policías. Uno de ellos muri ayer. El ministro del Interior, José Luis Pérez Guadalupe, ha denunciado la movilización de huaraqueros de Puno para incrementar la agresión contra los agentes.";"ART_001121";"premise";"argumentative";"claim";"nc";"nc";"argumentative";"claim";"PENDING";"PENDING";"manual"
"0";"5";"argumentative";"Perspectivas sobre el proyecto Ta Mara";"¿Por qué diría que está a favor del proyecto Ta Mara? Porque se generará empleo para la gente de Arequipa: 65% Porque ayudará a reactivar la economía de Arequipa: 50% Porque la minera contamina inevitablemente el medio ambiente: 57% Porque perjudicará la agricultura de la zona: 57% Entre los que están a favor del proyecto: Manipulados por intereses políticos: 64% Entre los que están en contra del proyecto: Manipulados por intereses políticos: 19% Cree usted que hay dirigentes y activistas políticos en las movilizaciones contra Ta Mara? Sí: 82% No: 14% No precisa: 4%";"2015";"?";"2015-05-10";"elcomercio";"¿Por qué diría que está a favor del proyecto Ta Mara? Porque se generará empleo para la gente de Arequipa: 65% Porque ayudará a reactivar la economía de Arequipa: 50% Porque la minera contamina inevitablemente el medio ambiente: 57% Porque perjudicará la agricultura de la zona: 57% Entre los que están a favor del proyecto: Manipulados por intereses políticos: 64% Entre los que están en contra del proyecto: Manipulados por intereses políticos: 19% Cree usted que hay dirigentes y activistas políticos en las movilizaciones contra Ta Mara? Sí: 82% No: 14% No precisa: 4%";"ART_001221";"claim";"argumentative";"claim";"nc";"nc";"argumentative";"claim";"PENDING";"PENDING";"manual"
"0";"6";"non-argumentative";"No quieren salir";"Los trabajadores insisten en laborar en el Centro Histórico de Lima. Obreros de imprentas protestan en el Cercado La manifestación duró más de tres horas y saturó las vías del centro. Decenas de trabajadores de las imprentas informales del Centro Histórico de Lima bloquearon ayer las cuadras 1 y 2 del jirón Caylloma para protestar por las clausuras y multas que impone la Municipalidad de Lima. Desde el 2012, este sector del Cercado es zona rígida para el negocio de la impresión. Los manifestantes se congregaron desde las 9:30 a.m. y recién se dispersaron tres horas después. Ellos protestaron cerca de la sede de Fiscalización del municipio y algunos decidieron cerrar sus negocios.";"2014";"Ellos protestaron cerca de la sede de Fiscalización del municipio y algunos decidieron cerrar sus negocios.";"2014-08-28";"elcomercio";"Los trabajadores insisten en laborar en el Centro Histórico de Lima. Obreros de imprentas protestan en el Cercado La manifestación duró más de tres horas y saturó las vías del centro. Dos imprentas fueron multadas. Decenas de trabajadores de las imprentas informales del Centro Histórico de Lima bloquearon ayer las cuadras 1 y 2 del jirón Caylloma para protestar por las clausuras y multas que impone la Municipalidad de Lima. Desde el 2012, este sector del Cercado es zona rígida para el negocio de la impresión. Los manifestantes se congregaron desde las 9:30 a.m. y recién se dispersaron tres horas después. Ellos protestaron cerca de la sede de Fiscalización del municipio y algunos decidieron cerrar sus negocios. Negocio de riesgo En el Centro Histórico quedan unas 1.100 imprentas informales, según la comuna metropolitana. El municipio reiteró ayer que las imprentas no pueden permanecer en dicho lugar, pues dañan el ornato y atentan contra la seguridad. El bloqueo del jirón Caylloma produjo una gran congestión en las vías del centro. Los trabajadores de las imprentas eran dirigidos por Oswaldo Carhuallanqui. Ellos admitieron que ya no deben trabajar en el Centro Histórico; no obstante, solicitaron a la Municipalidad de Lima que les ofrezca soluciones para el traslado. La Gerencia de Fiscalización aseguró que seguirá multando los negocios informales. Ayer fueron sancionadas dos imprentas con S/.7.600 y S/.11.400.";"ART_001243";"none";"argumentative";"premise";"nc";"nc";"argumentative";"claim";"PENDING";"PENDING";"manual"
"0";"3";"argumentative";"Para las autoridades, Ricardo Vásquez planeó el crimen y cómo desaparecer el cadáver de Armstar.";"El Concejo de Lima desocupó las vías a ambulantes, estibadores y carretilleros para garantizar la seguridad. Desde ayer las rutas de acceso y salida del Mercado Central y Mesa Redonda, en el Cercado, son controladas por 135 serenos de la comuna. Su labor consiste en despejar el comercio ambulatorio de los alrededores, así como en retirar a estibadores y carretilleros. En la madrugada de ayer, la Gerencia de Seguridad Ciudadana ejecutó una operación sorpresiva en los jirones Mir Quésada, Andahuaylas y Ayacucho. En los dos primeros, por ser estrechos, están prohibidas las carretillas. Pese al control, algunos estibadores se las ingenian para transportar la mercadería en hombros, lo que incomoda a los miles de compradores que recibe este emporio durante la temporada navideña. Los jirones Puno y Cusco fueron despejados por agentes de Defensa Civil. Esas calles también son vías de evacuación ante sismos o incendios.";"2013";"En la madrugada de ayer, la Gerencia de Seguridad Ciudadana ejecutó una operación sorpresiva en los jirones Mir Quésada, Andahuaylas y Ayacucho.";"2013-12-04";"elcomercio";"El Concejo de Lima desocupó las vías a ambulantes, estibadores y carretilleros para garantizar la seguridad. Desde ayer las rutas de acceso y salida del Mercado Central y Mesa Redonda, en el Cercado, son controladas por 135 serenos de la comuna. Su labor consiste en despejar el comercio ambulatorio de los alrededores, así como en retirar a estibadores y carretilleros. En la madrugada de ayer, la Gerencia de Seguridad Ciudadana ejecutó una operación sorpresiva en los jirones Mir Quésada, Andahuaylas y Ayacucho. En los dos primeros, por ser estrechos, están prohibidas las carretillas. Pese al control, algunos estibadores se las ingenian para transportar la mercadería en hombros, lo que incomoda a los miles de compradores que recibe este emporio durante la temporada navideña. Los jirones Puno y Cusco fueron despejados por agentes de Defensa Civil. Esas calles también son vías de evacuación ante sismos o incendios. Solo con un trabajo permanente podremos conservar la zona libre. Estaremos atentos a cualquier incidente, señaló Enrique Aguilar, gerente de seguridad de Lima. El funcionario dijo que los vecinos pueden denunciar emergencias o presencia de ambulantes al número telefónico 318-5050.";"ART_001267";"premise";"argumentative";"premise";"nc";"nc";"argumentative";"claim";"PENDING";"PENDING";"manual"
"0";"2";"argumentative";"El Proyecto";"El proyecto de construcción del parque del migrante contempla, entre otros gastos, la demolición de la infraestructura existente en La Parada, y luego la nivelación y pavimentación de la plaza. Todo ello representará el desembolso de casi S/.1817.000. Asimismo, se construirán canchas deportivas (para ello se destinarán S/.361.000) y un cerco perimetral de esta área (que costará S/.158.000). El parque en sí también tendrá un cerco (S/.256 mil). Se habilitará un área verde y se colocarán instalaciones sanitarias y electromecánicas. Todo ello representará aproximadamente 2 millones 670 mil soles. El proyecto, además, incluye talleres de promoción y difusión, a los cuales se destinarán S/.200 mil.";"2013";"Asimismo, se construirán canchas deportivas (para ello se destinarán S/.361.000) y un cerco perimetral de esta área (que costará S/.158.000).";"2013-12-03";"elcomercio";"El proyecto de construcción del parque del migrante contempla, entre otros gastos, la demolición de la infraestructura existente en La Parada, y luego la nivelación y pavimentación de la plaza. Todo ello representará el desembolso de casi S/.1817.000. Asimismo, se construirán canchas deportivas (para ello se destinarán S/.361.000) y un cerco perimetral de esta área (que costará S/.158.000). El parque en sí también tendrá un cerco (S/.256 mil). Se habilitará un área verde y se colocarán instalaciones sanitarias y electromecánicas. Todo ello representará aproximadamente 2 millones 670 mil soles. El proyecto, además, incluye talleres de promoción y difusión, a los cuales se destinarán S/.200 mil.";"ART_001376";"premise";"argumentative";"premise";"nc";"nc";"non-argumentative";"none";"PENDING";"PENDING";"manual"
"16";"6";"argumentative";"Humor";"{""paragraphs"": [""El gobierno peruano ha lanzado un nuevo programa de apoyo a las pequeñas y medianas empresas (pymes) afectadas por la pandemia. La iniciativa, llamada 'Reactiva Perú', busca brindar financiamiento a bajo interés para que las pymes puedan reiniciar sus operaciones. 'Este programa es fundamental para reactivar la economía y generar empleo', afirmó el presidente del Consejo de Ministros, Guido Bellido."", ""Las pymes representan más del 90% de las empresas en el país y son responsables de más del 50% del empleo formal. 'Sin ellas, no habrá recuperación económica', agregó el ministro de Producción, Raúl Pérez-Reyna."", ""Sin embargo, algunos empresarios han criticado que los requisitos para acceder al crédito son demasiado estrictos. 'Muchas pymes no cumplen con los criterios establecidos y quedarán excluidas', señaló el presidente de la Confederación Nacional de Instituciones Empresariales Privadas (CONFIEP), Pedro Olaechea."", ""A pesar de las críticas, el gobierno insiste en que las condiciones son necesarias para garantizar la sostenibilidad del programa. 'No podemos arriesgar los fondos públicos en proyectos que no tengan viabilidad', concluyó el ministro de Economía, Kurt Burnet.""]}";"2015";"'Muchas pymes no cumplen con los criterios establecidos y quedarán excluidas', señaló el presidente de la Confederación Nacional de Instituciones Empresariales Privadas (CONFIEP), Pedro Olaechea.";"2015-02-16";"elcomercio";"- Javier Prado - El tabano - El Tunche - Tolerancia cero a la delincuencia Luego del ingreso de un grupo de barristas de Alianza Lima a las instalaciones del club para realizar actos vandálicos, el representante de la Oficina Nacional de Gobierno Interior (ONAGI), Raúl Tenorio, señaló que el equipo blanquiazul no podrá jugar en Lima por lo menos durante cinco meses. Eso sería parte de una política de tolerancia cero que piensa aplicar el gobierno para enfrentar la inseguridad ciudadana.";"ART_001391";"claim";"argumentative";"claim";"nc";"nc";"argumentative";"claim";"PENDING";"PENDING";"manual"
