"sentence_text";"label_binary";"label_component"
"el gobierno debe crear un control estricto de inmigración en las zonas fronterizas con colombia";"argumentative";"claim"
"por q después del 20-8querrán venir en masa";"argumentative";"premise"
"a ver quién paga la factura y cómo se reparten el marrón de dejar inmigrantes ilegales sueltos por sus ciudades";"argumentative";"premise"
"(y que los votantes no de lo hagan paga r dentro de un año)";"argumentative";"claim"
"no sé dónde vives pero la delincuencia que he visto yo cuando he ido de vacaciones a madrid y a barcelona es absoluta";"argumentative";"premise"
"vale y estos señores al no tener papeles se ven totalmente internet de lo que les pueda pasar sin miedo total a la ley";"argumentative";"claim"
"como son españoles nada";"argumentative";"claim"
"sin fueran refugiados gloria";"argumentative";"premise"
"""jorge vestrynge: """"aquí no vienen cabreros sino gente emprendedora valiente y con formación profesional como mínimo""";"argumentative";"premise"
"que corra el vino que vinen ingenieros por la valla de ceuta emoji face with tears of joy emoji emoji face with tears of joy emoji emoji face with tears of joy emoji";"argumentative";"claim"
"vendieron una servicentro shell y echaron a todos los chilenos porque el nuevo dueño solo contrata inmigrantes tenemos mas del 7 % de desempleo y solo quieren inmigrantes";"argumentative";"premise"
"apoyas a los inmigrantes hasta que te quitan el empleo la polola la casa o la vida defiende a tu gente";"argumentative";"claim"
"la inmigraciòn de africa y países árebes es una estrategia para entrar a europa y atacarla desde dentro como hace mil años hicieron los barbaros para destruir el imperio romano el islan ataca una europa lacsa en leyes y desunida";"argumentative";"premise"
"marina lepen tiene razón nada d inmigrantes";"argumentative";"claim"
"pregunta : en cuánto incide el desempleo en sectores más básicos de la economía por la presencia de inmigrantes ?";"argumentative";"claim"
"si no puedo hacer esa pregunta estamos jodidos";"argumentative";"premise"
"alcaldesa los extranjeros que estan vendiendo en las calles los fiscalizan si estan legal en el país por que no los deportan si estan indocumentados";"argumentative";"claim"
"muy bien su trabajo las calles de providencia parecian interminables ferias";"argumentative";"premise"
"acá me ven y ya me hablan español";"argumentative";"premise"
"más sudaca no conseguís";"argumentative";"claim"
"que patético vergonzosa la historia de chile";"argumentative";"claim"
"un país del tercer mundo sometido a usa que puso a somoza trujillo y muchos otros patéticos dictadores sudacas";"argumentative";"premise"
"a pedirle papeles a todas las personas en la calle y pedir visa a todos el que quiera venir y deportar ilegales";"argumentative";"claim"
"si no tenemos control en los aeropuertos y puertos y frontera estamos jodidos invasión silenciosa vivir con tu enemigo sin contar con los apátridas";"argumentative";"premise"
"estamos en guerra";"argumentative";"claim"
"otras voces: ¿una sudaca y un discapacitado juntos?";"argumentative";"premise"
"por los papeles o por la pasta";"argumentative";"claim"
"como cuando juegas billar con un arabe musulman";"argumentative";"claim"
"falla un tiro y normal se enfada es como ""todos abajo puede traer una bomba """;"argumentative";"premise"
"y mejor lo dejas ganar";"argumentative";"claim"
"¿y de donde sacan para irse de vacaciones?";"argumentative";"premise"
"de verdad que esto ya pasa de castaño oscuro";"argumentative";"claim"
"¿refugiados y vuelven al lugar donde les maltrataban?";"argumentative";"premise"
"¿a qué están esperando para regularizar a la mafia de manteros ilegales y con muy mala leche ?";"argumentative";"claim"
"se creen que tienen todos los derechos del mundo hasta dónde sé en ningún país desarrollado te permiten estar viviendo ilegales y sin papeles y ni pensar lo de la sanidad";"argumentative";"premise"
"80 000 menores han entrado en españa solos desde marruecos luego llegará la reunificación familiar padres hermanos primos abuelos etc";"argumentative";"premise"
"¿para que los envía marruecos ? ¿alguien pide explicaciones a las autoridades marroquís? ¿son inmigrantes o enviados para invadir españa ?";"argumentative";"claim"
"los que asaltaron la valla de ceuta con lanza-llamas y con cal viva";"argumentative";"premise"
"¿ también son victimas";"argumentative";"claim"
"inmigracion ilegal deportacion ¡yaa";"argumentative";"claim"
"y entre otras cosas menos riesgo de terroristas infiltrados ¿no? - un mando único policial para combatir inmigración ilegal";"argumentative";"premise"
"sea insulto o no";"argumentative";"claim"
"los """"malditos sudacas"""" son los que tienen en pie a las ligas del fútbol español y europeo";"argumentative";"premise"
"pues la india de gandhi ese país tan espiritual son razas dominadas como los árabes dominados por un libro";"argumentative";"claim"
"tendencia a retroceder ante lo nuevo desprecio por la mujer por lo inferior según el criterio de estas simple minds los animales las mujeres las niñas los pobres";"argumentative";"premise"
"como siempre nuestras autoridades a última hora se dan cuenta d todos los problemas q generan los inmigrantes venezolanos sin haber cumplido los requisitos para este fin";"argumentative";"premise"
"una vez más se demuestra q son improvisadores y no previsores en conclusión terminan siendo informal todo";"argumentative";"claim"
"nos hicimos una pregunta el hashtag 17a de 2017 en hashtag barcelona otros muchos se la hicieron";"argumentative";"claim"
"¿con el mogollón de negros subsaharianos manteros que hay siempre en la rambla cómo es que ninguno fue arrasado por la furgoneta de younes abouyaaqoub? ninguno entre los 15 muertos en ramblas";"argumentative";"premise"
"ni arabes xq como payasos ponen su cara en mi familua y chinos xq ponen a un loco y un cinico assesino como mi mirada";"argumentative";"premise"
"recuerde senor presidente el xq ni arabes ni chinos";"argumentative";"claim"
"algo se pudre en el perú";"argumentative";"claim"
"es el caos organizado surrealista subsahariano nuestra realidad";"argumentative";"premise"
"refugiados si inmigrantes los necesarios y los que realmente podamos atender";"argumentative";"claim"
"pienso que españa sólo debería acoger y de una forma ordenada a inmigrantes latinoamericanos de habla española cristianos que";"argumentative";"premise"
"y en toda europa se estan matando y violando a millones y millones de blancos";"argumentative";"premise"
"pero eso ni lo mencionas tampoco mencionas que esos negros y arabes causan problemas";"argumentative";"claim"
"españa está siendo invadida por los subsaharianos";"argumentative";"premise"
"y aquí don tonto jugando al corro la patata desde la moncloa hashtag caminodevenezuela hashtag señorllevamépronto";"argumentative";"claim"
"con estas emigraciones hacia europa";"argumentative";"premise"
"un día los alemanes españoles no será de alemania y los árabes impondrán sus religiones y su cultura y los africanos harán lo mismo";"argumentative";"claim"
"me encanta contra el maltrato animal";"argumentative";"premise"
"pero a los inmigrantes subsaharianos que los acoja en su casa los perroflautas y @user";"argumentative";"claim"
"el que viene en yate de lujo no viene a pedir si acaso a negociar el que viene en patera no viene a dar viene a consumir los recursos sociales de los españoles";"argumentative";"premise"
"si cada uno de los 4 000 000 de populistas que los quiere se llevara un sólo inmigrante a su casa asunto resuelto";"argumentative";"claim"
"africanos saltan la valla de ceuta armados y hieren a 22 guardias civiles -manteros que no pagan impuestos y arruinan a los comercios toman el control de barcelona su alcaldesa lo permiten -turista defiende a una mujer los manteros le pegan una paliza";"argumentative";"premise"
"el feminismo calla";"argumentative";"claim"
"leo que es muy complicado expulsar a los inmigrantes ilegales porque es imposible conocer su procedencia";"argumentative";"premise"
"sin embargo todos tienen teléfonos móviles ¿tan difícil es averiguar a qué países hacen sus llamadas?";"argumentative";"claim"
"estos son lo pobrecitos refugiados de carmena ada colau y pedro sánchez";"argumentative";"claim"
"a ver que dicen cuando empiecen a matar y violar como ya han hecho a las mujeres de aquí";"argumentative";"premise"
"jerusalem le pertenece a los hebreos y no a los llamados palestinos";"argumentative";"claim"
"los palestinos nunca existieron en la historia los llamados palestinos son arabes musulmanes modernos ellos andan diciendo que son cananeos";"argumentative";"premise"
"""la """"marcha negra"""" acelera el paso: más de 40 000 subsaharianos esperan en marruecos para entrar ilegalmente en españa";"argumentative";"premise"
"okupa monclovita ¿ya tienes pensado donde cobijar a toda esta gente ?prepara barracas en moncloa creo que hay terreno """;"argumentative";"claim"
"los manteros subsaharianos desbocados las mafias se lian en torrevieja a sillazos contra la policia";"argumentative";"premise"
"eleccionesgeneralesya";"argumentative";"claim"
"en vez de derrochar el dinero en los inmigrantes indocumentados";"argumentative";"premise"
"preocúpese mejor de nuestro ancianos";"argumentative";"claim"
"todo aquel que quiere ver en esta invasion por el sur un problema migratorio se equivoca";"argumentative";"claim"
"en los que han asaltado la valla de ceuta solo veo hombres muy jóvenes fuertes valientes y desvergonzados dispuestos a poner a españa contra las cuerdas";"argumentative";"premise"
"pregunta seria: los pro vida se quejan de que en casi toda europa estados unidos canadá y una gran parte de asia son asesinos y deberían cerrar las piernas";"argumentative";"premise"
"o solo nosotras no podemos tener derechos por sudacas?";"argumentative";"claim"
"el pueblo exige mas atencion en cuanto al sistema alimentario y contra la especulacion de precios impuesto por los chinos turcos arabes y colombianos";"argumentative";"premise"
"defendamos lo nuestro hagamos patria @user";"argumentative";"claim"
"no se porque no existe un control fronterizo con colombia";"argumentative";"claim"
"radical transeúntes y autos transporte de todo tipo ademas todo colombia no indocumentado deportado";"argumentative";"premise"
"basta carajo";"argumentative";"claim"
"los reseponsables del ingreso al pais de tantos inmigrantes deben hacerse cargo del los problema s de salud de ellos";"argumentative";"claim"
"porque actualmente han venido a aumentar el grave problema de atencion medica de chilenos ocupando las pocas horas de atencion y recursos";"argumentative";"premise"
"los subsaharianos conocedores de que nuestro sistema de pensiones está en riesgo se organizan para asaltar nuestra frontera y hacerse cargo de nuestras jubilaciones";"argumentative";"premise"
"no temáis sólo vienen con el ánimo de hacer viables nuestros servicios sociales";"argumentative";"claim"
"por las mujeres tienen cuatro neuronas ???";"argumentative";"claim"
"una para cada fogon";"argumentative";"premise"
"las aceras son para el tránsito de personas";"argumentative";"premise"
"no para que gente sin papeles venda falsificaciones de manera ilegal bajo el paraguas del ayuntamiento";"argumentative";"claim"
"obviamente @user no iba a desvelar la nacionalidad de los";"argumentative";"claim"
"3 moro mierdas que han abusado en tudela de una niña";"argumentative";"premise"
"¿por que las mujeres se casan de blanco?";"argumentative";"claim"
"para hacer juego con el refrigerador la cocina y la lavadora hashtag humor";"argumentative";"premise"
"la inmigración también es un determinante de salud";"argumentative";"claim"
"el real decreto de 2012 esgrimía justificaciones como el turismo sexual: los inmigrantes no vienen por turismo sexual de hecho los que vienen son los más sanos fuertes jóvenes";"argumentative";"premise"
"cultura árabe = cultura machista";"argumentative";"claim"
"te lo digo xq me ha pasado lo mismo @user @user descendencia árabe siguen inculcando el machismo";"argumentative";"premise"
"los inmigrantes en hostales a pensión completa";"argumentative";"premise"
"y los españoles durmiendo en el coche";"argumentative";"claim"
"su tierra tiene un 60 % aprx de árabes argentinos y demás emigrantes mas los españoles que estamos a la par con ellos que rondamos el 20 %";"argumentative";"premise"
"la raza blanca en extinción y los payasos de cotillón ya mismo veréis a vuestros hijos haciendo el rama dan catalán";"argumentative";"claim"
"si yo mandara en españa aqui no entraba ni cristo sin papeles";"argumentative";"premise"
"que se valla a su pais";"argumentative";"claim"
"sin la reconquista no habría españa sino al ándalus de lengua árabe religión musulmana poligamia mujeres con burka enorme analfabetismo sharia";"argumentative";"premise"
"los efectos de la reconquista son plenamente actuales ¿entienden por qué es indispensable conocerla?";"argumentative";"claim"
"de hoy en adelante si una mujer te envía una foto desnuda hay que denunciarla por acoso sexual y provocación";"argumentative";"premise"
"femi nazis al ataque en 3-2-1";"argumentative";"claim"
"campaña para que ley rapa nui se extienda a todo el país";"argumentative";"claim"
"y así frenar la inmigración";"argumentative";"premise"
"hashtag sabiasque el cerebro de la mujer esta conectado al culo ?";"argumentative";"claim"
"porque cada vez que piensan la cagan";"argumentative";"premise"
"¿por qué las modelos tienen una neurona más que los caballos?";"argumentative";"claim"
"para no cagarse en los desfiles";"argumentative";"premise"
"por primera vez entiendo el odio de trump a los m exicanos";"argumentative";"claim"
"yer o antier 7 m exicanos intentaron robar dentro de un centro comercial una joyería los atraparon los 7 son : m exicanos i ndocumentados y rateros emoji pouting face emoji emoji pouting face emoji emoji pouting face emoji pagamos ""justos por pecadores"" me s";"argumentative";"premise"
"hace falta mas seguridad donde coloquen orden con";"argumentative";"claim"
"comerciantes informales y indocumentados venezolanos que venden productos quitando las ventas a los comercios que pagan impuestos";"argumentative";"premise"
"la izquierdona ha encontrado su mina de oro votará a su favor todo inmigrante que esté aquí unas cuantas semanas y votará a quienes les han traído aquí";"argumentative";"premise"
"les mantienen aquí les adoctrinan y les dan beneficios a costa de tu dinero y el mío";"argumentative";"claim"
"y pase lo que pase no votéis a una mujer";"argumentative";"claim"
"que no podrá ocuparse de su cargo por tener que cuidar la casa y lavar la ropa del hombre hashtag deber";"argumentative";"premise"
"asiaticos devastados por la guerra hoy tienen mejor estructura que chilito";"argumentative";"premise"
"cosas sudacas";"argumentative";"claim"
"el enojo de una mujer es como la luz de check engine";"argumentative";"claim"
"no tienes ni puta idea qué está pasando y es mejor esperar a que se apague solo";"argumentative";"premise"
"italia: una mujer evita con gas pimienta un intento de agresión sexual de un inmigrante ilegal nigeriano en la estación de tren de milán";"argumentative";"premise"
"esta es la realidad de la inmigración ilegal";"argumentative";"claim"
"q en los vuelos desde venezuela pongan un billete d 10$ en el baño dl avión q abran un taquilla d in migración cuando ya todos estén formados q pongan bolígrafos sueltos par llenar la plantilla de migración";"argumentative";"claim"
"allí pudieran filtrar justamente a los abusadores y deportarlos patras";"argumentative";"premise"
"es muy lógico hay que pagar los inmigrantes ilegales que entran en españa sin parar y no hay dinero para l@user español@user mientras sí dan papeles a todos";"argumentative";"premise"
"vergüenza";"argumentative";"claim"
"la muerte puede llegarte en cualquier momento y en cualquier lugar acá en el norte aquí solo eres carne y en estados unidos junto a los malditos israelitas con mayor razón";"argumentative";"claim"
"esos culeros son como los alacranes güeros se traicionan entre ellos a gran escala como en 11/09";"argumentative";"premise"
"mientras el común de los mortales padecemos una oleada violenta de musulmanes subsaharianos y una ola de calor subsahariano abrasante los proletarios @user y sus adlateres de vacaciones de millonario";"argumentative";"premise"
"que bien viven los proletarios de hoy en día";"argumentative";"claim"
"rennes (francia) : un hombre d 28 años salvajemente agredido y atacado con un cuchillo por 6 jovenes inmigrantes afganos";"argumentative";"premise"
"¿quien quiere llenar su pais de esta gente pensando q a el o a su familia no l puede afectar?";"argumentative";"claim"
"yo si fuese @user incluiría en mi programa la construcción de un muro en el estrecho de gibraltar y que lo paguen los propios subsaharianos";"argumentative";"premise"
"despertó la alcaldesa de la ciudad en la que un inmigrante con papeles casi fue muerto por inmigrantes sin papeles al defender a una mujer hostigada por éstos ¿no tendrá nada que decir?";"argumentative";"premise"
"¿le parecerá bien que los manteros hostiguen a señoras y peguen a turistas ?";"argumentative";"claim"
"este es el tipo de inmigración que deja muy mal parado al resto de los venezolanos";"argumentative";"premise"
"desgraciados";"argumentative";"claim"
"en mierditerráneo digital andan un poco obsesionados con las violaciones las ficticias";"argumentative";"premise"
"denunciar que un gc y un militar violaron a una cría de 18 años no queda muy patriota gays y un marroquí ¿serán gays negros sudacas o moros ?";"argumentative";"claim"
"a la frontera con ellos";"argumentative";"claim"
"a que impidan que la salten los subsaharianos";"argumentative";"premise"
"que buena vaina carajo con la cochina cultura árabe";"argumentative";"claim"
"no conforme con la invasion que tenemos xq ya los venezolanos parecemos extranjeros en nuestro propio país ahora canciones árabe s en emisoras radiales";"argumentative";"premise"
"no me jodan con esa cultura mal viviente";"argumentative";"claim"
"la inmigracion de personas de cultura similar o dispuestos a adaptarse y respetar nuestra cultura es beneficiosa";"argumentative";"premise"
"cientos de miles de indocumentados violentos ignorantes y fanatizados por la religión que vienen a vivir de ayudas es una invasión";"argumentative";"claim"
"hashtag stopglobalizacion d_nacional los españoles lo primero";"argumentative";"claim"
"d_nacional: alarma por los más de 50 000 subsaharianos que esperan en marruecos para cruzar a españa";"argumentative";"premise"
"la inmigración masiva va a destruir espa";"argumentative";"claim"
"nosotros no son mas los sudacas y centroamirdicanos";"argumentative";"claim"
"pasan por mi país violentando gente porque """"no tienen dinero"""" """"porque van en busca de una vida mejor"""" y ademas ilegal";"argumentative";"premise"
"absurda europa y bruselas";"argumentative";"claim"
"el populismo es lo que tienen ellos declarando un igualitarismo y socialismo fracasado un estado de bienestar para inmigrantes ilegales y para quienes no trabajan y de malestar para el que produce y le quitan todo con impuestos";"argumentative";"premise"
"no huyen de ninguna guerra";"argumentative";"claim"
"cuando huyes de una guerra no vuelves a tu país de """"vacaciones"""" con las ayudas del estado español pero que no es nada nuevo casi la totalidad de las mujeres """"sirias"""" llevan velo cuando siria es un país cristiano";"argumentative";"premise"
"nos vamos a convertir como venezuela"" decían ahora hasta en los semáforos se habla chamo";"argumentative";"premise"
"quiero ver al señor duque y a los ministerios y cancillería que van hacer con tanto inmigrante chamo zolano";"argumentative";"claim"
"cuando veais a los pobres muslims acordaron que ademas de";"argumentative";"claim"
"sangraros gracias a las ayudas y subvenciones que nuestros mayores no reciben se llevan el dinero a traves de mezquitas y locutorios";"argumentative";"premise"
"cuando me hicieron la casa vinieron trabajadores indocumentados de argentina que no estaban registrados";"argumentative";"premise"
"mi casa fue la que expusieron en el prado hasta el día de hoy tiene entrada de agua por todos lados y problemas enormes sin solución";"argumentative";"claim"
"telediario de las 15 h: - alemanes siembran el pánico en metro de valencia - rumanas carteristas en metro de barcelona - árabes agreden a turistas en barcelona";"argumentative";"premise"
"racismo? no";"argumentative";"claim"
"dios los cría y ellos se juntan";"argumentative";"claim"
"los sin papeles con los sin papeles";"argumentative";"premise"
"estos son los que nos están invadiendo";"argumentative";"premise"
"y nosotros acogiendo como refugiados y regalandoles todos nuestros servicios sociales";"argumentative";"claim"
"que les pasa a todos que me quieren hacer usar turbante de arabe";"argumentative";"claim"
"soy negro pero tampoco para tanto";"argumentative";"premise"
"@user y @user tienen razón";"argumentative";"claim"
"los inmigrantes vienen a imponernos sus costumbres";"argumentative";"premise"
"si no te gusta puedes cambiarlo";"argumentative";"claim"
"destino sudaca";"argumentative";"premise"
"pues a mi el hebreo o lo que farfullan los sionistas me suena muy parecido al árabe";"argumentative";"claim"
"lo digo por lo racistas que son con todo lo que este relacionado con los árabe s";"argumentative";"premise"
"mientras los manteros atacan a turistas y hay reyertas en el raval ada colau ha visitado el pueblo italiano de riace repoblado dando casas a inmigrantes y refugiados un """"ejemplo de acogida integración y lucha contra la xenofobia""""";"argumentative";"premise"
"pues que se quede allí indefinidamente";"argumentative";"claim"
"los traficantes de inmigrantes proactiva open arms están dando vueltas entre cerdeña y túnez con 87 inmigrantes malta e italia no les dan permiso para desembarcar y otra vez quiere venir a españa";"argumentative";"premise"
"que los desembarque en túnez libia egipto que europa está llena sobran la mayoría";"argumentative";"claim"
"con la sanidad abierta a todo el mundo y cobrando del paro con pocos requisitos";"argumentative";"premise"
"yo si fuera inmigrante me venia de cabeza menudo chollo";"argumentative";"claim"
"se debería incluir en las escuelas la asignatura del islam";"argumentative";"claim"
"ya que para el 2050 españa será mayoría musulmana y así empezar a adaptarse";"argumentative";"premise"
"con q vengan muchos ya sobra aquí hay demasiados d todos subsaharianos en las calles tirados manteros perjudicando comercios legales y vendiendo copias marroquíes donde trabaja el y viven la mujer 4 niños y 4 abuelos";"argumentative";"premise"
"en ciudades y pueblos estamos llenos a su casa";"argumentative";"claim"
"andrej babiš presidente del gbno checo rechaza de plano la inmigracion subsahariana no los queremos en chequia";"argumentative";"claim"
"nunca tendrian un empleo y para mantenerlos aqui q se les ayude en sus paises de origen sus costumbres no son compatibles con las nuestras";"argumentative";"premise"
"hay varias paginas de feministas a las que deberia darles verguenza exponer sus ideas";"argumentative";"claim"
"ya que no tienen ni pies ni cabeza";"argumentative";"premise"
"esas cosas y otras pueden pasar por mantener a la inmigracion ilegal en españa y no expulsarlos ¿no?";"argumentative";"claim"
"la agresión de los manteros a un turista pone a colau en un aprieto";"argumentative";"premise"
"de los moros no se puede esperar nada bueno";"argumentative";"claim"
"y esto te lo dicen los propios árabes que también han luchado contra ellos";"argumentative";"premise"
"que nacionalidad o etnia crees que se adapta mejor a la vida occidental europea (tema derechos y libertades mujer lgtb convi pf mejor chinos";"argumentative";"claim"
"porque yo creo que ya estamos muy acostumbrades y idk peor los árabes yo";"argumentative";"premise"
"¿esto podría explicar el brutismo caribeño y el subsahariano ? ¿habrá correlación?";"argumentative";"claim"
"extreme heat linked with reduced cognitive performance among young adults in non-air-conditioned buildings";"argumentative";"premise"
"pasan las horas y @user aún no ha convocado ninguna manifa en apoyo a esta menor ninguna feminazi se solidariza con ella";"argumentative";"premise"
"parece que si los violadores son inmigrantes es menos delito que si lo hace un español";"argumentative";"claim"
"los últimos episodios de violencia ejercida por subsaharianos en ceuta barcelona y salou nos demuestran que no son buena gente y que no aportan nada positivo a nuestra sociedad";"argumentative";"premise"
"stop pateras no a la invasión";"argumentative";"claim"
"la gente inmigrante que ha entrado en españa de modo legal y se integran en nuestra sociedad se les llama personas de color";"argumentative";"premise"
"los ilegales que entran por la valla atacando a nuestros agentes delinquiendo y agrediendo a nuestros ciudadanos son negros e islamistas sin adornos";"argumentative";"claim"
"esta invasión continuada de subsaharianos no se cuanto nos cuesta imagino que cantidades astronómicas";"argumentative";"premise"
"por qué no empleamos esta pasta en hacer que vuelvan los españoles que tenemos por el mundo médicos investigadores y demás profesionales";"argumentative";"claim"
"los árabes inteligentes y creadores de civilización brillaron desde los inicios de la humanidad hasta la época en que el islamismo poseyó totalmente a ese pueblo";"argumentative";"premise"
"y lo relegó al oscurantismo y el atraso";"argumentative";"claim"
"enseñan al pueblo español a amedrentarse frente a un enemigo";"argumentative";"premise"
