"sentence_text";"label_binary";"label_component"
"yo enseño a mis hijos a saber defenderse sea mantero presidente del gobierno o saltador negro de la valla de melilla";"argumentative";"claim"
"en suecia están abriendo los ojos";"argumentative";"claim"
"el partido antiinmigración ganaría las elecciones generales del próximo mes de septiembre";"argumentative";"premise"
"cada vez son más los países que se dan cuenta del errror de acoger a miles de indocumentados sin que aporten nada";"argumentative";"claim"
"""el efecto llamada existe es una llamada de verdad telefónica";"argumentative";"claim"
"un inmigrante indocumentado que comparte un cuartucho con otros diez en madrid y corre ante la policía para poner a salvo las imitaciones baratas de bolsos de moda";"argumentative";"premise"
"esto es una invasión africana";"argumentative";"claim"
"salvamento marítimo como cooperador necesario y oneges ni te cuento de que viven?? nadie denuncia que van a por inmigrantes a aguas marroquíes";"argumentative";"premise"
"vaya futuro tiene españa";"argumentative";"claim"
"no nos confundamos muchas mujeres posan de victimas de acoso solo con una mirada";"argumentative";"premise"
"ridículas ¿estas se habrán comparado con lo que sufrieron las guerrilleras en las farc por ejemplo?";"argumentative";"claim"
"""a nuestro país llegan ya no solamente los migrantes ""tradicionales"" desde la fachada noroccidental africana ahora proceden de toda áfrica y de asia";"argumentative";"premise"
"somos la plataforma europea """"ideal"""" para refugiados e in migrantes de cualquier parte del mundo";"argumentative";"claim"
"atención la inteligencia norteamericana advierte de una invasión inminente de 100 000 subsaharianos";"argumentative";"premise"
"hashtag defiendeespaña elecciones ya";"argumentative";"claim"
"""ojalá haber grabado a todas las señora s que me han mirado mal en el bus y me han hecho pasar momentos incómodos";"argumentative";"claim"
"sobre todo a esa señora que todo el camino vino diciendo en voz alta: """"las sudacas consiguen lo que quieren en españa a cambio de sexo """" claramente refiriéndose a mi";"argumentative";"premise"
"en las últimas 24h varias peleas callejeras en ceuta por parte de los últimos en saltar violentamente la valla";"argumentative";"premise"
"y el gobierno pide respeto???";"argumentative";"claim"
"pablo casado acusa a los inmigrantes de las altas temperaturas porque """"el negro atrae el calor """"";"argumentative";"premise"
"las cámaras de seguridad del metro de milán han grabado cómo una joven de 25 años logra defenderse de un nigeriano de 31 años que quiso violarla afortunadamente la joven supo reaccionar a tiempo";"argumentative";"premise"
"es lógico que matteo salvini quiera expulsar a los inmigrantes ilegales";"argumentative";"claim"
"suriel hace años en venezuela vivimos eso mismo la entrada incontrolable de indocumentados de los paises vecinos llevo todo tipo de personas al país";"argumentative";"premise"
"que los metan presos o que los deporten y extremar medidas para que no entre este tipo de gente";"argumentative";"claim"
"si estamos cogiendo ejemplo de los arabes";"argumentative";"premise"
"mal vamos";"argumentative";"claim"
"no son subsaharianos son negros";"argumentative";"claim"
"que yo sepa sudán y níger están en el sáhara";"argumentative";"premise"
"estos putos negratas noos van a robar toda la pasta iñaqui";"argumentative";"premise"
"menos mal que yo la tengo en panamá";"argumentative";"claim"
"lo único que debe votar una mujer son sus tetas cuando hacen deporte";"argumentative";"premise"
"hashtag gravedadantetodo";"argumentative";"claim"
"un tio de 26 años de camerún (pais en guerra espero que note la ironia) con dos hijos que no puede mantener (como la mitad de los africanos) que dice que se ha dedicado a violar menores y animales desde que salió de camerún";"argumentative";"premise"
"inmigrante económico como él dice";"argumentative";"claim"
"alguna de sus co secuencias no siendo las peores que las hay y graves";"argumentative";"claim"
"""""sin papeles"""" una joven sufre seis fracturas tras ser arrollada por un grupo de manteros en la gran vía";"argumentative";"premise"
"crece a 1 402 la entrada de inmigrantes a ceuta";"argumentative";"premise"
"la mitad de ellos al asalto";"argumentative";"claim"
"en lo que va de 2018";"argumentative";"premise"
"con la inmigración de los africanos";"argumentative";"premise"
"nos vais a llenar las calles de heroína y comercio ilegal gracias de todo corazón además de acortar nuestras listas de espera en la sanidad gracias a la sanidad pública universal";"argumentative";"claim"
"estoy flipando";"argumentative";"claim"
"le estaba diciendo a este chico que mi padre pegaba e insultaba a mi madre que tiene dos denuncias por violencia de género y órdenes de alejamiento y se puso a decirme que él jamás pensaría que la mujer tiene razón que si eso me pasó a mí es porque soy árabe";"argumentative";"premise"
"el mensaje de carmena q animaba a asaltar la valla de melilla como fuera los cuerpos de seguridad están desbordados y la asistencia colapsada";"argumentative";"premise"
"los asaltos violentos a la valla de ceuta y melilla son un gran problema pero hay políticos q animan a hacerlos";"argumentative";"claim"
"@user dijo que sus comentarios en campaña son nada comparados con la realidad";"argumentative";"premise"
"que sabrán esos yankis si hashtag grandemarlaska dice que no haay colapso en los centros de acogida de inmigrantes adelante con ellos";"argumentative";"claim"
"la inteligencia norteamericana advierte de una invasión inminente de 100 000 subsaharianos";"argumentative";"premise"
"la solución política:";"argumentative";"premise"
"1 no renovar residencia y expulsar a tantos marroquíes como subsaharianos entren desde marruecos no habría nadie en la valla 2 deducir de las ayudas al desarrollo a un país el coste de la repatriación de sus inmigrantes que lleguen ilegalmente a españa";"argumentative";"claim"
"llegan 900 venezolanos por día al perú";"argumentative";"premise"
"cuantos más tendrán que venir para que ya se ponga coto y fin a esta invasión ?";"argumentative";"claim"
"qué ya no es una inmigración a las autoridades peruanas no les da ni la tos por este tema";"argumentative";"premise"
"solo reaccionarán cuando esto se desborde";"argumentative";"claim"
"deben abstenerse de acercarse a la valla de melilla";"argumentative";"claim"
"al menos hasta que los """"lindos negritos visitantes"""" estén estreñidos";"argumentative";"premise"
"y mientras a los que somos españoles trabajamos y cotizamos nos eternizamos esperando k nos operen y nos kitan medicinas";"argumentative";"claim"
"¡manda cojones sánchez da sanidad gratis a los sin papeles pero no a los inmigrantes legales";"argumentative";"premise"
"lo primero que tendría que hacer pdr snchz cuando vuelva de vacaciones es una sesión de fotos practicando footing en la moncloa rodeado de negros perdón subsaharianos";"argumentative";"claim"
"con eso lo arreglábamos todo hasta podríamos usar a obama de extra";"argumentative";"premise"
"pregunta para la izquierda esta es para nota";"argumentative";"claim"
"si abrimos las fronteras indiscriminadamente y sin control y un inmigrante agrede a una mujer inmigrante también con la que está en una relación sentimental ¿cómo se le localiza para citarle a juicio después de la agresión?";"argumentative";"premise"
"la ropa de los indocumentados es cada vez más horrible";"argumentative";"premise"
"me dan pena chabon los colores los modelos todo asqueroso";"argumentative";"claim"
"tu peloteo es ridiculo";"argumentative";"claim"
"para ti un latinoamericano siempre será un sudaca o panchito nunca lo trataras h consideraras de tu nivel";"argumentative";"premise"
"vergüenza de tanto indocumentado a favor de la jauría de lo políticamente correcto";"argumentative";"claim"
"la sentencia contra juana rivas es machista si es un hombre quien lo hace y la condena el doble no sería hembrista sino justa";"argumentative";"premise"
"dan mucho asco estos políticos juezas y tertuliano/as";"argumentative";"claim"
"soy partidario de ayudar a la gente sin papeles pero se están aprovechando de nuestra solidaridad lo que faltaba por ver agredir a turistas y policias";"argumentative";"premise"
"la única manera que nos obligan hacer es mantero sin papeles mantero a su país";"argumentative";"claim"
"me quieren seguir en ig un montón de árabes/turcos/israelíes";"argumentative";"premise"
"creo que tengo cara de terrorista y no me di cuenta";"argumentative";"claim"
"la inmigracion legal si crea riqueza pero los ilegales solo nos cuestan dinero a los contribuyentes por que se les da de todo ¿no?";"argumentative";"premise"
"la riqueza se crea no se reparte";"argumentative";"claim"
"menudo chiste";"argumentative";"claim"
"sin papeles sin dirección conocida puede estar en cualquier parte ya y aunque lo pillen dará igual lo defenderá open arms y todas las instituciones";"argumentative";"premise"
