"sentence_text";"label_binary";"label_component"
"la adopción es un bien sustituible con la maternidad subrogada todos los estudios incluso el del comité de bioética y de deontología médica español habla que el que vuelen las parejas que están teniendo una maternidad subrogada es un tipo de experiencia que mediante una adopción no se puede tener";"argumentative";"claim"
"esto es una realidad";"argumentative";"premise"
"según el diccionario de cambridge legalizar significa permitir una conducta o una práctica que había sido prohibida con anterioridad no nos han llevado ningún tipo de otro modelo de prohibición";"argumentative";"claim"
"el que tenemos ahora y que de hecho es el que los tiene a todos los países del mundo donde está prohibido no es eficaz";"non-argumentative";"none"
"el alto comisionado de las naciones unidas por los derechos humanos expresó que el respecto a la dignidad humana es responsabilidad de todos los estados el que más tiene que importar a la hora de la maternidad subrogada son los derechos de las personas vulnerables";"argumentative";"claim"
"las personas más es vulnerables adentro de esta ecuación el menor y la madre gestante";"argumentative";"premise"
"el alto comisionado de las naciones unidas por los derechos humanos expresó que el respecto a la dignidad humana es responsabilidad de todos los estados el primer derecho que se tiene que proteger es lo del menor";"argumentative";"claim"
"en primer lugar un efecto que se denomina turismo o exilio reproductivo cuando llegan a espanya estas parejas de las élites económicas que han ido a explotar en otros países y llevan el niño a este niño se lo tiene que registrar obligatoriamente";"argumentative";"claim"
"el derecho al registro a la nacionalidad y a la identidad son unos derechos fundamentales de los niños";"argumentative";"premise"
"es inmoral crear nuevos niños a expensas de vulnerar derechos a las mujeres ustedes dicen que tenemos que regular la gestación subrogada porque es imposible prohibirlo todos los países pero no cree que este es un motivo insuficiente para regular esta práctica";"argumentative";"claim"
"legislar no es liberalizar legislar es dar los derechos que se merecen todas las partes de esta ecuación";"argumentative";"claim"
"este niño queda protegido mediante el registro y mediante el análisis de cuál será su mejor interés por su afiliación";"argumentative";"premise"
"garantizaremos los derechos a las madres gestantes como han dicho el comité de bioética español y de antología se tiene que respetar su dignidad su libertad su integridad física y su integridad moral";"argumentative";"claim"
"garantizaremos los derechos a las madres gestantes como han dicho el comité de bioética español y de antología durante todo el proceso esta madre gestante tendrá derecho a quedarse este niño si lo decide";"argumentative";"claim"
"garantizaremos los derechos a las madres gestantes como han dicho el comité de bioética español y de antología una vez ha tenido el niño tendrá seis semanas para poder quedárselo cómo es el método que hacen al canadà o islàndia";"argumentative";"claim"
"también tendrá derecho a poder acabar con su embarazo";"argumentative";"premise"
"garantizaremos los derechos a las madres gestantes como han dicho el comité de bioética español y de antología podrá decidir cuál es su método de vida y al final tendrá todas las garantías sanitarias que se merece";"argumentative";"claim"
"tenemos los medianos de hecho espanya somos el mejor sistema sanitario de toda la unión europea";"argumentative";"claim"
"será un procedimiento altruista porque no estamos hablando de comercializar estamos hablando de una colaboración donde no se pueda explotar a nadie";"argumentative";"claim"
"no cree que la propia idea de la gestación subrogada aunque sea altruista es degradante en sí misma porque implica cosificar la mujer al servicio otras seria cosificar la mujer si se estuviera comercializando con ella";"argumentative";"claim"
"será un procedimiento altruista porque no estamos hablando de comercializar es una colaboración que sobre todo tiene que estar libre";"argumentative";"claim"
"será un procedimiento altruista porque no estamos hablando de comercializar porque sea libre tiene que ser altruista";"argumentative";"claim"
"no puedes estar decidiendo sobre ser una madre gestante o no ser una madre gestante dependiente de tu situación económica";"non-argumentative";"none"
"garantizaremos los derechos a las madres gestantes como han dicho el comité de bioética español y de antología esto es el sistema que tenemos por ejemplo a sur-àfrica que tenemos a holanda que tenemos a bèlgica y que tenemos al canadà";"argumentative";"claim"
"en primer lugar un efecto que se denomina turismo o exilio reproductivo un sistema que ha funcionado porque ha reducido e incluso ha eliminado como al canadà el turismo reproductivo";"argumentative";"claim"
"en primer lugar un efecto que se denomina turismo o exilio reproductivo las parejas o las personas que quieren contratar una maternidad subrogada en vez de irse a países como pueden ser la india cambodja o ucraïna se quedan a su propio país";"argumentative";"claim"
"donde el estado de derecho se los puede garantizar los derechos a todos los elementos de lo equaci";"argumentative";"premise"
"no cree que el hecho que sea una práctica gratuita está fomentando la invisibilització del trabajo de la mujer entonces cualquier práctica gratuita está invisibilizado cualquier tipo de importancia de alguien";"argumentative";"claim"
"no cree que el hecho que sea una práctica gratuita está fomentando la invisibilització del trabajo de la mujer si yo estoy haciendo un voluntariado está invisibilizado-me no";"argumentative";"claim"
"sí que tendría que legalizarse la maternidad subrogada no queremos que sea un trabajo";"argumentative";"claim"
"sí que tendría que legalizarse la maternidad subrogada esto no es un servicio";"argumentative";"claim"
"será un procedimiento altruista porque no estamos hablando de comercializar que no fuera altruista justamente va en contra de vuestra línea";"argumentative";"claim"
"no voléis que se comercialice no voléis que se objectivitzi";"argumentative";"claim"
"ni siquiera nos estáis proponiendo que esto no sea gratuito";"non-argumentative";"none"
"la maternidad biológica";"argumentative";"premise"
"no entra dentro del debate";"non-argumentative";"none"
"pero una desigualdad que se está dando en los países donde se está explotando a las mujeres";"non-argumentative";"none"
"tenemos los medianos si tenemos los medios si tenemos la intención por qué no ponerlos a disposición de la dignidad de toda la población del mundo";"argumentative";"claim"
"los casos concretos son casos que son fuera de espanya como dijeron las naciones unidas estos derechos no son solo responsabilidad para nuestros nacionales somos responsables de los derechos fundamentales de todos los humanos en todo todo el mundo";"argumentative";"claim"
"cumplir los objetivos de desarrollo evitando esta pobreza";"non-argumentative";"none"
"desigualdad con la que estamos completamente de acuerdo evitando esta desigualdad";"argumentative";"claim"
"redistribuir los recursos es la solución";"argumentative";"premise"
"legislar no es liberalizar legalizar es garantizar";"argumentative";"claim"
"se encuentran contra toda maternidad la foto es bastante ejemplificando";"argumentative";"claim"
"se encuentran contra toda maternidad ya se entiende que es el que estamos defendiendo";"argumentative";"claim"
"porque el deseo de tener hijos tiene que pasar por encima de derechos como es dignidad de las mujeres que están ya sometidas de desigualdades a día de hoy la gestación subrogada es una forma de llevar al mundo más hijos";"argumentative";"claim"
"es una forma de potenciar la maternidad estamos en contra porque hemos identificado cuáles son los objetivos prioritarios en nuestro mundo";"argumentative";"claim"
"porque el deseo de tener hijos tiene que pasar por encima de derechos como es dignidad de las mujeres que están ya sometidas de desigualdades a día de hoy no tenemos que llevar más hijos al mundo";"argumentative";"claim"
"es el que realmente hace que estos problemas todavía se desarrolle más";"argumentative";"premise"
"la contaminación se soluciona solucionando la situación a la india solo no la cantidad de población que cada vez va además se soluciona solucionando la situación de la india de àfrica no";"argumentative";"claim"
"cada vez tendremos más población con independencia de la situación de la india";"argumentative";"premise"
"cada vez tendremos menos recursos con independencia a la situación de la india";"argumentative";"premise"
"la contaminación se soluciona solucionando la situación a la india solo no cada vez tendremos más problemas que hemos identificado como aquellos que la comunidad internacional tiene que solucionar con independencia de que nosotros tengamos la capacidad o no de solucionar los problemas a la india";"argumentative";"claim"
"a la india a àfrica tienen problemas un problema que tienen ellos y nosotros es precisamente la poca capacidad que tenemos de redistribuir recursos";"argumentative";"claim"
"si quieren disminuir la maternidad como podríamos mantener la tasa de recuperación de las generaciones";"non-argumentative";"none"
"a la india tienen muchos hijos tienen una sobrepoblación";"argumentative";"claim"
"a la india tienen muchos hijos si vienen aquí seguro que podrán trabajar aquí";"argumentative";"claim"
"a la india tienen muchos hijos solucionamos este problema";"argumentative";"claim"
"respetan todos los derechos";"non-argumentative";"none"
"me es absolutamente igual";"non-argumentative";"none"
"con independencia de que los derechos se respeten nosotros estamos en contra en la maternidad subrogada aunque sea con el respecto a todos los derechos de la mujer el que estamos haciendo es llevar más hijos al mundo";"argumentative";"claim"
"la gestación subrogada porque legitima idees prácticas e instituciones que han ocasionado las desigualdades existentes y que impiden acabar con ellas hay un experto nils bergen que nos dice que en el caso del bebé no se respetan estos derechos";"argumentative";"claim"
"un bebé piensen que ha estado nueve meses en la panza de su madre que hormonalment está preparado para sentir cuando acaba de salir al mundo su madre para reconocerla le sacamos el bebé de su madre";"argumentative";"claim"
"un bebé piensen que ha estado nueve meses en la panza de su madre que hormonalment está preparado para sentir cuando acaba de salir al mundo su madre para reconocerla estamos respetando aquí los derechos de bebés no";"argumentative";"claim"
"porque el deseo de tener hijos tiene que pasar por encima de derechos como es dignidad de las mujeres que están ya sometidas de desigualdades a día de hoy estamos llevando a bebés al mundo";"argumentative";"claim"
"lo hacemos con una probabilidad muy elevada que tenga consecuencias psicológicas negativas";"non-argumentative";"none"
"entonces están de acuerdo que la india sigan teniendo hijos y aquí no";"non-argumentative";"none"
"esto es la asamblea nacional de las naciones unidas a mí el representante de la india me está escuchando y le dirá exactamente el mismo";"argumentative";"claim"
"como retribuimos los recursos";"argumentative";"premise"
"día once de abril del dos mil diecinueve quedan tres mil novecientos veinte días porque podamos cumplir los objetivos y los retos de la agenda del desarrollo sostenible como basura que solucionar todos los problemas de la agenda dos mil treinta";"argumentative";"claim"
"porque el deseo de tener hijos tiene que pasar por encima de derechos como es dignidad de las mujeres que están ya sometidas de desigualdades a día de hoy no es ético llevar hijos";"argumentative";"claim"
"la gestación subrogada porque legitima idees prácticas e instituciones que han ocasionado las desigualdades existentes y que impiden acabar con ellas cada vez haya más desigualdades y menos recursos";"argumentative";"claim"
"es precisamente esto el que hace que nosotros nos posicionamos en contra";"argumentative";"premise"
"será un procedimiento altruista porque no estamos hablando de comercializar y que que sea altruista";"argumentative";"claim"
"yo ahora mismo se los regalas un móvil o una televisión vosotros valoraríais económicamente este móvil o esta televisión como el dinero que os habéis ahorrado del que os he regalado a mí me regalan un niño altruistamente pero yo puedo valorar económicamente el bebé que me han dado con el dinero que yo me he ahorrado";"argumentative";"claim"
"yo ahora mismo se los regalas un móvil o una televisión vosotros valoraríais económicamente este móvil o esta televisión como el dinero que os habéis ahorrado del que os he regalado si a mí me dan un bebé que costa entre ciento treinta mil euros y me lo da una mujer de forma altruista yo pensaré me he ahorrado ciento treinta mil euros";"argumentative";"claim"
"no cree que la propia idea de la gestación subrogada aunque sea altruista es degradante en sí misma porque implica cosificar la mujer al servicio otras es altruista sí";"argumentative";"claim"
"será un procedimiento altruista porque no estamos hablando de comercializar no es cierto que el hecho que sea altruista no sea mercantil";"argumentative";"claim"
"yo ahora mismo se los regalas un móvil o una televisión vosotros valoraríais económicamente este móvil o esta televisión como el dinero que os habéis ahorrado del que os he regalado yo estoy valorando económicamente por lo tanto esto es negativo";"argumentative";"claim"
"con la adopción también está mercantilizando los niños";"argumentative";"premise"
"en primer lugar tenemos un argumento egoísta la adopción la fomento yo";"argumentative";"claim"
"consigo que sea un mecanismo gratuito como lo es actualmente";"argumentative";"premise"
"estamos en contra de hacer aquellas prácticas que hacen que aquella balanza de allí se desequilibre";"argumentative";"premise"
"la gestación subrogada es pensar partir del inicio de qué es correcto llevar hijos al mundo";"non-argumentative";"none"
"porque el deseo de tener hijos tiene que pasar por encima de derechos como es dignidad de las mujeres que están ya sometidas de desigualdades a día de hoy que es un deseo realizable";"argumentative";"claim"
"en primer lugar tenemos un argumento egoísta por qué tenemos que continuar celebrando que llevamos un hijo al mundo cuando hay personas a àfrica cuando hay personas a la india que realmente están esperando que alguien los ayude";"argumentative";"claim"
"consigo acabar con la mala redistribución de recursos";"argumentative";"premise"
"es inmoral crear nuevos niños a expensas de vulnerar derechos a las mujeres consigo no vulnerar derechos de las mujeres";"argumentative";"claim"
"hacemos aquello que hace que la balanza se pueda llegar a una situación de igualdad";"argumentative";"premise"
"ahora hace dos años me inicié en el maravilloso mundo del debate hoy en el mismo marco en qué empezó la red vivas cierro un ciclo de manera definitiva y lo hago con plena convicción de una cosa el debate tiene que ser una herramienta para crear un consenso común para construir y no para destruir la opinión del adversario es por eso que siempre que puedo intento proponer puntos que tenemos en común todos los equipos en este caso un objetivo fundamental volemos un mundo mejor y más cerca de la igualdad de género sin embargo nosotros creemos que vayamos más allá con dos factores claves también con la igualdad ante la pobreza infantil y la igualdad ante el acceso al medio ambiente por lo tanto así prohibir la gestación subrogada hemos dicho somos más cerca de conseguir los objetivos de la agenda del dos mil treinta que nos ha dicho el otro equipo tres cosas principales un argumento fáctico uno de moral y uno de jurídico nos han dicho en primer lugar que como que es una realidad que se está dando el que tenemos que hacer es legalizarla nosotros hemos dicho el hecho que se den algunos países que esté permitido no quiere decir que no lo podamos prohibir en todos estos países la solución óptima hemos dicho para acabar este turismo reproductivo es prohibirlo en todo el mundo nos han dicho que esto es bastante difícil pero por lo tanto si fuera factible si fuera fácil si todos nos pudiéramos poner de acuerdo estaríamos de acuerdo con este tratado así pues nosotros estamos de acuerdo también en que se tendría que prohibir todo el mundo en segundo lugar nos han dicho que por un argumento moral tenemos que garantizar que se cumplan los derechos humanos no que se estén vulnerando como está pasando ahora en aquellos países en que sí que se está permitiendo nosotros hemos dicho que el hecho que haya vulneraciones de los derechos humanos no implica no es razón suficiente para legalizar la práctica que ahora los está vulnerando porque nosotros estamos en contra de la propia idea de la gestación subrogada de la propia concepción que esta implica y como tal la queremos prohibir tal en primer lugar hemos dicho que es inmoral legalizar esta práctica cuando a día de hoy hay todavía tantos niños desamparados hemos dicho que tenemos que hacer una legislación más efectiva porque la adopción sea más fácil una adopción que va más allá de la concepción de mi propio hijo como hijo genético o biológico que rompe este paradigma y entiende también que la adopción es otra forma de filiación en segundo lugar una cuestión de género hemos dicho que legalizarla va en contra de los adelantos del feminismo por qué dos cosas perpetúa el rol de la mujer en sus funciones domésticas como persono gestando como fuente de vida y fuente de nueva creación y en segundo lugar implica la cosificación de ella misma hemos dicho aunque sea altruista aunque sea gratuito la propia idea que la mujer sea un recipiente de gestar por terceras personas es degradante y la corrompe en tercer lugar por una cuestión medioambiental porque a día de hoy cada vez los recursos son más escasos son más contaminados por parte de seres humanos y por tanto no queremos llevar más niños en estas condiciones ni personas que todavía empeoren más este medio ambiente porque como decían algunos autores vivimos en la tierra de alguna manera como si tuviéramos la esperanza de vivir en alguna otra por lo tanto nosotros no queremos que david copperfield haga desaparecer la estatua de libertad pero tampoco queremos que todos los humanos que legalizando la gestación subrogada hagamos desaparecer el mundo queremos construir un mundo mejor así pues nosotros en definitiva el que hemos propuesto es la prohibición de la gestación subrogada porque creemos que somos algo más cerca de equilibrar aquella balanza una balanza que a día de hoy es desigual y lo hemos propuesto de equilibrar esta balanza de la desigualdad con los niños las mujeres y el medio ambiente a través del debate porque como decía roben williams en el club de los poetas muertos no olviden que a pesar de todo el que les digan las palabras y las ideas pueden cambiar el mundo gracias";"non-argumentative";"none"
"bueno buenas tardes ahora pasaré a concluir este debate en primer lugar muchas gracias al equipo contrario porque creemos que ha sido un debate maravilloso en que se han aportado muchas ideas que nos han enriquecido mucho a todos personalmente muchas gracias al jurado y muchísimas gracias al público asistente así para empezar recuperaremos qué ha sido el punto clave de su línea y es que al final ellos nos decían estamos en contra la maternidad sin embargo es una respuesta a si por ejemplo es ético o no tener hijos biológicos no sí se tiene que legalizar o no una maternidad subrogada a pesar de que creemos que en sí su línea no responde la pregunta debate entendemos analizar sus argumentos es que en primer lugar nos llevaban en un argumento egoísta de que se tenía que poner fin a la maternidad subrogada para fomentar la adopción es el que ha hecho mi compañera no es más lógico poner fin a la pobreza de estos países puesto que ustedes se plantean estos estos objetivos porque estos niños puedan quedarse justamente a sus países es que además justamente en su segunda refundación han dicho que por ejemplo maternidad subrogada nunca sería altruista porque siempre lo valorarías mercantilmente por lo tanto al final su argumento cae por su propio peso porque al final la adopción también es alguien que recibe sin ninguna contraprestación y también estaría mal según su línea porque entonces también lo estaría valorando usted mercantil bien por lo tanto al final su argumento ni contesta la pregunta de debate y además cae por su propio peso es que en segundo lugar nos hablan de la situación de la mujer y de querer una igualdad de género y el que nosotros hemos estado identificando nuestros dos turnos refundación es que al final volemos una igualdad de género a nivel abstracto y a nivel español porque todos los importante argumentos de como esta desigualdad de género se está dando otros países y como espanya está siendo cómplice y simplemente no sabían contestar esto y es más nos llevaban un argumento sobre el cambio climático un argumento medioambiental es que al final la solución como ya ha dicho mi compañera no es llevar menos hijos al mundo si la solución es de redistribución de recursos redistribuimos los recursos es que todo el rato nos decían claro se tiene que llevar menos hijos al mundo pero en ningún momento nos han presentado ningún tipo de modelo si piensan convencer la población si piensan tomar medidas de otro tipo no nos han llevado ningún tipo de modelo ya nos decían es que se tiene que prohibir en todo el mundo y han insistido mucho en esta idea cuando desde nuestro primero primer turno de refundación los hemos demostrado que era imposible para vivir todo el mundo en primer lugar porque hablábamos de convenios internacionales en los cuales una buena parte de este mundo nos están violando los derechos humanos no ni siquiera firmado y en segundo lugar porque atentaba contra la soberanía nacional de estos países dos ideas a las que tampoco nos ha podido responder en este debate es más y volviendo a su idea sobre lo mala que la maternidad biológica en sí y por el contrario también la maternidad subrogada porque la fomentaba miren cómo hemos dicho a nuestros dos turnos de refundación no estamos discutiendo si es bueno o doliendo estamos diciendo qué pasa ellos nos llevan una utopía nos llevan muchas ideas pero nosotros los llevamos a la realidad se los llevamos la situación española y a todo el mundo y es que volvamos a nuestra línea que hemos presentado en primer lugar hemos presentado un primer argumento en el que decíamos es una realidad transnacional imposible de prohibir y es que al final no lo han entendido porque nos han dicho bueno es que es una realidad que pasa espanya que pasemos o no esta es una realidad que no solo está pasando fuera de espanya está pasando a espanya porque espanya justamente son los propios españoles que se están yendo cómo hemos demostrado a ucraïna a la india a geòrgia ejemplos que tampoco nos han sabido refutar a tener los hijos y después vienen aquí y los pueden inscribir por lo tanto ustedes defienden que están en contra la pobreza que pobreza tiene nombre de mujer y somos cómplices y responsables por qué porque mediante la no legalización de esta maternidad subrogada el único que estamos fomentando es que se explote estas otras mujeres que porque no sean españolas no quiere decir que no sea nuestra responsabilidad como ya hemos demostrado es que en tercer lugar los llevaban modelos modelos en los cuales se protegía la dignidad porque si no van suficientes garantías hemos demostrado que esto era posible hemos llevado sur-àfrica islàndia canadà tres modelos por los que tampoco han tenido respuesta porque proteger al final es garantizar es que volvemos a nuestra idea del ilusionista tenemos que acabar con esta ilusión de proteger la dignidad de la mujer y protegerlas verdaderamente legalizando la maternidad subrogada muchas gracias";"non-argumentative";"none"
"vivo en una sociedad muy desigual donde unos pocos lo tienen todo y la mayoría nos hemos convertido en sus esclavos hagamos todo el trabajo sucio por ellos";"argumentative";"claim"
"vivo en una sociedad muy desigual donde unos pocos lo tienen todo y la mayoría nos hemos convertido en sus esclavos nos utilizan como fábricas de bebés";"argumentative";"claim"
"vivo en una sociedad muy desigual donde unos pocos lo tienen todo y la mayoría nos hemos convertido en sus esclavos las mujeres ricas ya no quieren gestar ni parir";"argumentative";"claim"
"el proceso implica un riesgo muy grande para ellas";"argumentative";"premise"
"su figura es demasiado importante para perderla por culpa del bebé";"argumentative";"premise"
"se llegó a la conclusión de que lo podrían hacer las miserables que ya limpiaban su inmundicia";"argumentative";"premise"
"vivo en una sociedad muy desigual donde unos pocos lo tienen todo y la mayoría nos hemos convertido en sus esclavos condenaron mi vida";"argumentative";"claim"
"deshicieron mi voluntad y mi dignidad";"argumentative";"premise"
"vivo en una sociedad muy desigual donde unos pocos lo tienen todo y la mayoría nos hemos convertido en sus esclavos de repente se encontraron sin amigos y familia";"argumentative";"claim"
"cerradas controladas siempre";"argumentative";"premise"
"obligadas a hormonarse";"argumentative";"premise"
"a parir bebés como sí de máquinas se tratara";"argumentative";"premise"
"la realidad era miserable";"argumentative";"premise"
