"sentence_text";"label_binary";"label_component"
"saben el que es esto sí un catálogo";"argumentative";"claim"
"un catálogo de mujeres gestantes que tienen unas determinadas características genéticas para dar este fruto niños";"argumentative";"premise"
"alguien de ustedes cogería estos niños elegiría estas mujeres en un catálogo";"argumentative";"premise"
"no el más probable es que no";"argumentative";"premise"
"primero solo un dos coma siete por ciento de personas que hay en esta sala podría permitírselo";"argumentative";"premise"
"no hace falta que le pagas a nadie ni siquiera costearse los gastos que genera la gestación subrogada";"argumentative";"premise"
"que quiere decir que haya un catálogo";"argumentative";"premise"
"que hay elegidos y gente que elige";"argumentative";"premise"
"por qué eligen estos niños";"argumentative";"premise"
"de verdad quieren crear un marco legal que dé validez jurídica para permitir el desarrollo de esta actividad";"argumentative";"premise"
"entendemos gestación subrogada como manera de acceder a la maternidad a través de la cual se emplea un vientre externo la maternidad será el centro de este debate";"argumentative";"claim"
"el primer argumento la gestación subrogada contrae una profunda incoherencia moral con el que entendemos nosotros que es la maternidad la maternidad es el acto seguramente más extremo de altruismo y generosidad que se puedan imaginar";"argumentative";"claim"
"cuántos de los que estamos esta sala o todavía vivimos con nuestros padres o todavía dependemos económicamente o simplemente nos ayudan en todo momento";"argumentative";"premise"
"el primer argumento la gestación subrogada contrae una profunda incoherencia moral con el que entendemos nosotros que es la maternidad así pues entendemos profundamente incoherente que un capricho de unos padres que quieren tener unos hijos por el simple hecho de compartir genética con estos hijos está totalmente en contraposición con la generosidad que representaría adoptar estos hijos";"argumentative";"claim"
"tenemos un segundo argumento que es un argumento legal por qué legislamos por las élites es profundamente anticonstitucional";"argumentative";"claim"
"y en tercer lugar tenemos un argumento que lo denominamos de supremacismo biológico a partir del momento en que dejamos personas elegir en un catálogo características genéticas estamos yendo al capricho de unas personas que modelan otras genéticamente";"argumentative";"claim"
"gestación subrogada técnica por la cual una mujer acepta dar su consentimiento para quedarse embarazada y posteriormente parir librar este bebé en una familia comitente o a un tercer";"argumentative";"claim"
"esta es la definición es el punto de partida";"argumentative";"premise"
"no obstante de este punto se pueden derivar muchos modelos diferentes";"argumentative";"premise"
"modelos que pueden tener una trascendencia muy importante hacia la mujer gestante hacia el neonato y hacia la familia comitente";"argumentative";"premise"
"sí a la legalización de la gestación subrogada porque es necesaria por la reproducción";"argumentative";"claim"
"sí a la legalización de la gestación subrogada porque es una necesidad humana";"argumentative";"claim"
"sí a la legalización de la gestación subrogada porque las mujeres puedan ser libres";"argumentative";"claim"
"quién somos nosotros para decir a una mujer qué hacer o dejar de hacer con su propio cuerpo";"argumentative";"premise"
"porque aquellas personas que físicamente no puedan tener hijos puedan";"argumentative";"premise"
"sí a la legalización de la gestación subrogada el como";"argumentative";"claim"
"y será evitando toda la problemática actual de los modelos ya existentes";"argumentative";"premise"
"sí a la legalización de la gestación subrogada uno sí a la legalización de la gestación subrogada razonable";"argumentative";"claim"
"uno sí sostenible éticamente";"argumentative";"premise"
"uno sí altruista protector y garante con todas las partes involucradas";"argumentative";"premise"
"quien son estas partes";"argumentative";"premise"
"las familias comitentes familias monoparentales de hombres y parejas gays parejas de lesbianas y heterosexuales o monoparentales de mujeres en las cuales estas no puedan gestar con su propio útero que no quiere decir que sus óvulos no sean viables";"argumentative";"premise"
"paralelamente a la donación de órganos in vivo también hay mujeres que quieren ceder su vientre de manera voluntaria y altruista";"argumentative";"premise"
"y por último los menores gestados a la extranjero";"argumentative";"premise"
"daremos respuesta a que pasa si se saltan nuestro modelo";"argumentative";"premise"
"desincentivamos la gestación a la extranjero";"argumentative";"premise"
"este es nuestro modelo altruista sin retribución que no quiere decir sin compensación económica por la mujer";"argumentative";"claim"
"porque sabemos que el embarazo es un proceso muy difícil";"argumentative";"premise"
"pero es que la mujer tiene que ser libre de elegir qué tiene que hacer con su propio cuerpo";"argumentative";"premise"
"y como dijo la activista estadounidense margaret sanger las mujeres no podemos ser libres sin tener el control sobre nuestro propio cuerpo";"argumentative";"premise"
"este es nuestro modelo altruista sin retribución con nuestro modelo evitaremos que se puedan producir problemáticas aplicando el sistema de la donación de órganos y de la adopción";"argumentative";"claim"
"un modelo público basado en la solidaridad y la voluntariedad anónima";"argumentative";"premise"
"(inaudible)";"non-argumentative";"none"
"nos centraremos en que es una necesidad humana la reproducción";"argumentative";"premise"
"en segundo lugar que es una cuestión de libertados";"argumentative";"premise"
"las familias comitentes se pueden aferrar perfectamente con un principio rector de nuestro ordenamiento jurídico de la constitución española";"argumentative";"premise"
"como es el de que los poderes públicos tienen que asegurar la protección jurídica económica y social de todas las familias que quieran formarlas una familia al treinta y nueve punto de la constitución española";"argumentative";"premise"
"y esto por lo tanto abre la puerta a legalizar la gestación subrogada con la libre elección de las familias";"argumentative";"premise"
"hay que agotar las vías de técnicas de reproducción asistida";"argumentative";"premise"
"estamos de acuerdo que no es una vía para todo el mundo";"argumentative";"premise"
"usted hablaba de los costes que quiere privatizar la sanidad española y está haciendo aquí la contabilidad de la sanidad";"argumentative";"claim"
"tenemos un sistema sanitario público aprovechémoslo";"argumentative";"premise"
"que tenemos unas garantías y unas infraestructuras privilegiadas";"argumentative";"premise"
"usted hablaba de los costes no vayamos a buscar los costes que supone nuestra sanidad";"argumentative";"claim"
"nos basamos en una doctora que ustedes tienen el privilegio de tener la universidad de barcelona eleonora lant";"argumentative";"premise"
"ella dice que detrás la gestación subrogada y el libre desarrollo de la personalidad la capacidad de consentimiento de la mujer quién somos nosotros para decir a una mujer que es el que puede hacer o dejar de hacer con su propio cuerpo";"argumentative";"premise"
"además nos encontramos con una cuestión de solidaridad";"argumentative";"premise"
"solidaridad que se basa en un acto altruista";"argumentative";"premise"
"que esto es el que evita cualquier mercantilización";"argumentative";"premise"
"vuestros argumentos son los que caracterizan nuestro modelo sin vuestras críticas nuestro modelo no sería posible";"argumentative";"claim"
"y como es altruista no atenta por lo tanto a la dignidad de la persona";"argumentative";"premise"
"totalmente";"non-argumentative";"none"
"es usted consciente que no es el mismo fundar una familia que tener descendencia y sobre todo escoger cómo será esta descendencia pero es que ustedes se están oponiendo a que se pueda fundar la familia";"argumentative";"claim"
"que se pueda crear la familia a través de otra vía como es la gestación subrogada";"argumentative";"premise"
"se oponen a la libertado";"argumentative";"premise"
"que haya una vía disponible más para el colectivo lgtbi por el colectivo de gente que no tienen la posibilidad de tener hijos";"argumentative";"premise"
"y en tercer lugar que nos encontramos con una ineficacia de la prohibición idealista en un mundo globalizado por mucho que prohibimos y cerramos los ojos no podemos parar el que regulen los países terceros";"argumentative";"claim"
"porque esto es una cuestión de derecho internacional público";"argumentative";"premise"
"qué podemos hacer nosotras la soberanía nacional de los países terceros";"argumentative";"premise"
"que diría usted a los niños que potencialmente podrían ser adoptados y que están en espera de adopción";"non-argumentative";"none"
"que nuestro modelo se basa en dos puntos esenciales el altruismo que se basa en la donación de órganos y los requisitos de idoneidad que se basa con el sistema de adopción nosotros el que volamos es velar por el interés superior del menor de esta gente que también está esperando que una familia la adopte";"argumentative";"claim"
"que nuestro modelo se basa en dos puntos esenciales el altruismo que se basa en la donación de órganos y los requisitos de idoneidad que se basa con el sistema de adopción porque todos los requisitos están basados en la adopción y el altruismo";"argumentative";"claim"
"al final implica que una mujer gestante gesta el hijo sin recibir dinero a cambio";"argumentative";"premise"
"ningún vientre puede tener un precio por lo tanto mercantilización cabe ni una";"argumentative";"premise"
"y de donde saldrían las mujeres";"argumentative";"premise"
"conocen el que es la donación intervivos";"argumentative";"premise"
"es el hecho que una persona viva y sana da un órgano a una persona desconocida";"argumentative";"premise"
"por lo tanto nosotros tenemos fe y creemos en el altruismo";"argumentative";"premise"
"y que pasaría si se saltan este sistema";"argumentative";"premise"
"pues que pueden estar en contra de la gestación subrogada";"argumentative";"premise"
"pero que no pueden estar en contra es del interés superior del menor";"argumentative";"premise"
"la dirección general del registro del notariado y el tribunal supremo ya lo han dicho bien claro que la gestación subrogada es claramente interés superior del menor";"argumentative";"premise"
"en primer lugar aquí llevo el que es el resumen de una publicación donde hacen un tipo de resumen de todas las muertes de manera mundial que tienen los centros de adopción los nins con una exclusión muy alta acaben suicide";"argumentative";"claim"
"estos nins tienen que tener una segunda oportunidad";"argumentative";"premise"
"en segundo lugar da garantía el hecho que se apruebe aquí a espanya la gestación subrogada hará que este trabajo sea con unas condiciones laborales óptimas naltros basura un trabajo podría hacer un trabajo ocho horas e iba a can nuestra";"argumentative";"claim"
"dar luz significa veinticuatro horas diarias nueve meses de trabajo";"argumentative";"premise"
"esto no tiene precio";"argumentative";"premise"
"esto es una cosa gratuita como especie humana";"argumentative";"premise"
"lo nasciturus que tiene que ser beneficiario de esta rutina humana tiene que tener una felicidad tiene que crecer y sobre todo no tiene que ver que todo sea un precio";"argumentative";"premise"
"si yo voy a can mía ahora porque va mal este debate púas me apoyarán";"argumentative";"premise"
"pero no me apoyarán por cinco euros";"argumentative";"premise"
"es decir tú el que quieres el primer hijo para tener unas arcas del estado también con más dobleros";"non-argumentative";"none"
"el hecho de ser humano implica que los sentimientos no pueden votar es decir tenemos una necesidades biológica que no se tienen que votar";"argumentative";"claim"
"si continuamos el statu quo del equipo contrario podrá suceder que su leyes conservadoras tanto puede ser de la esclavitud tanto puede ser de las dictaduras que hubieran continuado porque íbamos bien";"non-argumentative";"none"
"la compensación que es de resarcimiento pretende proteger a la mujer por todos los gastos asociados o los daños y perjuicios que pueda tener el proceso de embarazo usted está en contra de proteger la mujer";"argumentative";"claim"
"es decir el hecho de aprobar significa que este comercio venderá espanya por lo tanto esta mujer estarán haciendo este trabajo";"argumentative";"claim"
"y este trabajo que es precaria significa que sufrirán más porque están haciendo este trabajo";"argumentative";"premise"
"la esclavitud era una cosa mala dijeron se para hoy y no lo volveremos a hacer";"argumentative";"premise"
"pararemos hoy su gestación subrogada y no se volverá a hacer";"argumentative";"premise"
"porque como he dicho su solución reside al dar segundas oportunidades este nins";"argumentative";"premise"
"porque estos nins tienen el derecho a decirlo porque ya son vivos";"argumentative";"premise"
"lo tenemos que dar una segunda oportunidad de una inserción a la sociedad";"argumentative";"premise"
"no tenemos que dar más problemas en este mundo no tenemos que evitar los problemas que ya existen porque nuestro compañeros están evitando";"argumentative";"claim"
"se están botando el comité internacional de protección de nins o el derecho a registrarse derechos sobre todo en mujeres segundo apartado y reintegración";"argumentative";"premise"
"porque están a la adopción no pueden volver a tener padre ni ningún tipo de familia sino que los tenemos que dejar hacia un costado";"argumentative";"premise"
"han dicho que somos personas y tenemos sentimientos los padres tienen sentimientos";"argumentative";"claim"
"han dicho que somos personas y tenemos sentimientos las personas tienen sentimientos";"argumentative";"claim"
"han dicho que somos personas y tenemos sentimientos la gente quiere tener hijos quiere tener descendencia es un sueño de muchas veces necesitan ser felices";"argumentative";"claim"
"si lo el equipo contrario me puede decir un país donde la gestación subrogada sea perfecta que por favor coja el micro mis lo diga habéis dicho que no hay ningun país que lo regule de manera perfecta";"argumentative";"claim"
"por eso nosotros no adoptan ningun modelo de jefe otro país";"argumentative";"premise"
"se da cuenta de que nuestro argumento biológico podría ser perfectamente anónimo pero habría un turismo genético en nuestro modelo estamos por estamos previendo que solo puedan acceder en esta maternidad subrogada nacionales o residentes en territorio español";"argumentative";"claim"
"por lo tanto no podría venir nadie de fuera a tener aquí una maternidad subrogada";"argumentative";"premise"
"sabemos que es un punto débil de nuestro modelo y el que volamos es que con vuestra ayuda podamos hacer un modelo mejor y por tanto podríamos acabar decidiendo que sea la familia comitente que pague por ejemplo la in vitro";"argumentative";"claim"
"tenemos que legislar por nuestra propia gente";"non-argumentative";"none"
"tenemos que legislar por nuestro propio país no podemos legislar por todo el mundo";"argumentative";"claim"
"que nuestro modelo se basa en dos puntos esenciales el altruismo que se basa en la donación de órganos y los requisitos de idoneidad que se basa con el sistema de adopción no cualquiera persona puede ser mujer gestante y cualquier persona o puede ser familia comitente";"argumentative";"claim"
"la mujer gestante para ser libre tiene que ser ella propia la que decida si quiere o no ser mujer gestante";"argumentative";"premise"
"y por tanto tenemos aquí tres puntos a hablar";"argumentative";"premise"
"las mujeres que accedan tienen que tener una suficiencia económica para asegurar que sea altruista";"argumentative";"premise"
"porque no queremos que vayan por la pensión de resarcimiento";"argumentative";"premise"
"ha tenido de ser madre anteriormente porque ya conozca este sentimiento de tener para sus adentros un niño";"argumentative";"premise"
"la capacidad natural esta mujer tiene que ser consciente que el que está haciendo es una gestación subrogada";"argumentative";"premise"
"la ley de adopción establece criterios de valoración de idoneidad";"argumentative";"premise"
"los progenitores comitentes no cualquiera persona podrá acceder";"argumentative";"claim"
"las personas que son aptas para ir la adopción son aptas también por la gestación subrogada";"argumentative";"premise"
"y las que no son aptas por la adopción es porque no pueden ser buenos padres tampoco lo serán aptos para maternidad subrogada";"argumentative";"premise"
"los progenitores comitentes también para ser progenitores comitentes se tienen que haber agotat previamente todas las técnicas de reproducción asistida";"argumentative";"claim"
"queremos ayudar los necesitados";"argumentative";"premise"
"no los que lo quieren";"argumentative";"premise"
"me gustaría acabar una frase de la emma watson que dice tu cuerpo y la forma en que me compartes con el mundo tiene que ser una elección propia me gustaría que lo pudierais hacer real";"argumentative";"premise"
"en primer lugar agradecer al equipo contrario de la universidad de barcelona la organización la red vivas los miembros del jurado el público asistente físicamente y virtualmente por streaming bien a lo largo del debate en la universidad de lleida expuesto el porqué y lo como y ha contestado claramente en todas sus preocupaciones porque todas sus preocupaciones son sobre abusos son sobre malas prácticas son en definitiva con sensación de preocupación constante sobre el que podría pasar si se aplicara una gestación subrogada errónea y esto es el que precisamente nosotros evitando con nuestro modelo y por el que hace al por qué ya hemos explicado que la legalización de la gestación subrogada es imprescindible porque nos encontramos con una situación en la cual las familias comitentes y progenitores tienen una necesidad humana para reproducirse además nos encontramos con una situación en la cual podríamos resumir que es una cuestión de libertades de progreso porque a lo largo del tiempo siempre se han planteado supuestos sobre temas de este estilo como por ejemplo ha supuesto el avort una confrontación en la sociedad y en este caso nos encontramos con el mismo y a lo largo del debate la gestación subrogada se ha demostrado que podría perfectamente aplicarse y dar un paso adelante y ganar en libertades en tercer lugar el tercero porque hemos dicho que nos encontramos con una ineficacia de la prohibición idealista cuando nos encontramos en un mundo globalizado y no podemos hacer nada en cuanto a los países que han aplicado una gestación subrogada que nosotros no compartimos porque ya hemos dicho lo como que se basa en el altruismo y en unos requisitos de idoneidad por lo tanto el altruismo elimina cualquier tipo de duda que podáis tener sobre la mercantilización sobre los catálogos que ustedes han hecho referencia a los catálogos ya se los pueden quedar nosotros no los compramos nosotros hemos defendido claramente que nuestro modelo sería altruista y que se basaría en la donación de órganos teniendo en cuenta que nos encontramos a espanya y que nos encontramos en una posición privilegiada no solo también por el sistema sanitario sino porque llevamos más de veintiséis años liderando la lista de países en transplantants y de donación de órganos por lo tanto además hemos expuesto que ya se tendrían que cumplir unos requisitos de idoneidad no solo se tienen en cuenta la donación de órganos sino que también la adopción la adopción que ustedes también los preocupaba por el que hace al interés superior del menor al cual hemos defendido a través de la dirección general del registro y del notariado y el tribunal supremo miren como ya hemos dicho todas sus preocupaciones todo en cuanto a las malas prácticas nuestro modelo no tiene nada a ver y el equipo de la universidad de barcelona ustedes han preferido cerrar los ojos a lo largo del debate han preferido quedarse con la situación actual con una situación que por mucho que ustedes sigan criticando seguirá sucediendo si ustedes que esto que critican no se los gusta intenten cambiarlo porque si no lo hacen seguiremos igual seguiremos con abusos con malas prácticas y con una situación de inseguridad jurídica por lo tanto en definitiva la universidad de lleida se posiciona claramente a favor de legalizar la gestación subrogada porque decimos sí a la libertad decimos sí a una gestación subrogada garantista éticamente sostenible y razonable decimos sí a progresar a no es estancarnos en el siglo veinte y el pasado a progresar mirar más adelante del siglo veintiuno porque la universidad de lleida considera que legalizar la gestación subrogada es la única vía posible para eliminar todas sus preocupaciones que han criticado al largo del debate";"non-argumentative";"none"
"buenas tardes estamos todos muy cansados pero aun así hemos tenido un debate muy interesante y por eso agradecer a nuestros compañeros interesante porque desde el principio hemos tenido mucho de choques y ellos nos han presentado la maternidad como una necesidad humana nos han planteado los seres humanos que se dijera y como animales que seguimos nuestros instintos de maternidad que necesitamos tener descendencia y asegurar nuestra supervivencia de nuestro especie ninguno de estos conceptos tenían peso en el debate porque nosotros seres humanos vivimos en una sociedad tenemos en cuenta los derechos nos han dicho la adopción no es suficiente porque es solo una opción pero nunca nos han razonado porque esta opción no era viable por qué no era necesario optar por esta opción en lugar de ir a la gestación subrogada con todos los riesgos que esto comporta nos han dado bueno un modelo nos han dicho un supuesto cómo han quedado muchas veces con palabras vacías de lanza tener poéticamente con garantías y además con muchos detalles que nos han detallado bastante tarde pero aun así entraba en choque directamente con nuestra postura por lo tanto quedaba fuera cómo pues porque esta sostenibilidad ética este altruismo sin retribución nos decían todo esto como entraba en choque como hacía caer la incoherencia moral de no dar derechos los niños que necesitan una familia para dar un capricho a unos padres que vuelan una descendencia concreta como entraba esto en choque con la incoherencia legal no nos decían no entes por una minoría porque es un sistema público pero lo hemos dicho esto es peor lo pagamos entre todos cuando se trata de un capricho no tenía sentido tampoco entre lugar como por eso el turismo genético nos ha dicho no es que solo estamos regulando qué pasa con las madres de aquí solo dejamos que las madres de aquí puedan ser gestantes pero esto en ningún momento contestaba a cómo estamos actuando respecto a las personas que salgan de aquí se van a contratar a una madre gestante de otro país y tornan con su hijo como si no hubiera pasado nada esto nos decían que se pueden hacer muchos modelos y los hemos demostrado que ninguno de estos modelos podría ser viable porque los problemas de la gestación subrogada entran tienen que ver con su esencia hay temas troncales que la hacen totalmente inviable qué son estos temas tocar qué era el nuestro argumentación digamos en primer lugar hay una incoherencia moral que no podemos ignorar por qué porque entran en conflicto un capricho este deseo de tener una descendencia concreta con los derechos de los niños que necesiten una familia e incluso ha dicho mi compañero de vez el derecho en la vida he dicho incluso lo david qué los dirían ustedes los niños que están para adoptar han dicho bueno un modelo basado en los derechos por adopción es decir no han contestado que pasa con esta con estas personas segundo lugar una incoherencia legal porque solo la gente que puede pagar una gestación subrogada los gastos ligados directamente a la gestación subrogada es decir in vitro es decir los gastos de la gestante solo esta gente se lo podía permitir y la otra opción que es que lo pagamos todo sería todavía peor es decir bueno hablemos lo pagamos todos no pagamos todos no este era un asunto vital y por tanto ninguno de las opciones era buena y en tercer lugar hemos hablado de un supremacismo genético la maternidad a la carta da alas a criterios basados en rasgos en prejuicios en racismos todo esto no se puede concebir no se puede aceptar es por eso que primero porque este catálogo no se trata de tablas que quedan bien en nuestro comedor sino de personas con derechos en segundo lugar porque no podemos dejar escoger cuando nos afecta a totsi en tercer lugar porque no podemos dejar todo esto en lugar de racismos gracias";"non-argumentative";"none"
"hace dos meses veinticinco familias españolas quedaron atrapadas a ucraïna no se reconocía la nacionalidad española al menor nacido por gestación subrogada ante esta realidad innegable el estado es ciego";"argumentative";"claim"
"haciendo así que se produzca una situación de desprotección jurídica al menor nacido por gestación subrogada";"argumentative";"premise"
"mediante tres sólidos argumentos lo primero la protección del menor";"argumentative";"claim"
"mediante tres sólidos argumentos el segundo las garantías de los padres";"argumentative";"claim"
"mediante tres sólidos argumentos y lo tercero la libertad de la mujer gestante";"argumentative";"claim"
